filterByRating,ratingScore,reviewDescription,reviewTitle,language,corrected_review,cleaned_review,classification,clean_review2,cpu,speed,processor,upgrade,core,temperature,cost
threeStar,3,"I had tons of issues with this cpu. I returned it and purchased elsewhere due to Amazon not having a replacement option or any available at the time for prime shipping. The one that I have now works great, so it's a good product if you get one that works.My second gripe with this cpu is that it's basically just a refresh of 13th gen without the luxury of working out of the box with z790 mobos. You will need to flash the bios of your mobo.",Issues...,en,"I had tons of issues with this CPU. I returned it and purchased elsewhere due to Amazon not having a replacement option or any available at the time for prime shipping. The one that I have now works great, so it's a good product if you get one that works.By second grip with this CPU is that it's basically just a refresh of with gen without the luxury of working out of the box with z790 mobs. You will need to flash the bits of your mob.",ton issue cpu returned purchased elsewhere due amazon replacement option available time prime shipping one work great good product get one worksby second grip cpu basically refresh gen without luxury working box z790 mob need flash bit mob,NEGATIVE,"['ton', 'issue', 'cpu', 'returned', 'purchased', 'elsewhere', 'due', 'amazon', 'replacement', 'option', 'available', 'time', 'prime', 'shipping', 'one', 'work', 'great', 'good', 'product', 'get', 'one', 'worksby', 'second', 'grip', 'cpu', 'basically', 'refresh', 'gen', 'without', 'luxury', 'working', 'box', 'z790', 'mob', 'need', 'flash', 'bit', 'mob']",0.24062565,0.46582612,0.48557964,0.5534588,0.4791449,0.5973929,0.2827692
twoStar,2,"Ive bought AMD for a long time, this is my first time trying intel and seeing no thermal paste is like a spit in the face.",No thermal paste?,en,"Ve bought AMD for a long time, this is my first time trying inter and seeing no thermal paste is like a spit in the face.",bought amd long time first time trying inter seeing thermal paste like spit face,NEGATIVE,"['bought', 'amd', 'long', 'time', 'first', 'time', 'trying', 'inter', 'seeing', 'thermal', 'paste', 'like', 'spit', 'face']",0.1481522,0.4370598,0.3526829,0.5228395,0.333863,0.68031985,0.27628514
fourStar,4,"This processor is a speed demon. Gaming, editing, encoding, and whatever else you can think of, it can handle. The performance is there. The value for money is quite good too. Unless you really want top of the line, this chip effectively eliminates the i9 from consideration. 20 cores. 8P and 12E. Boost up to 5.6GHz on 2 threads. I swapped a 12600K for this part and I'm still kinda staggered at just how fast it is in heavily threaded apps. This is a perfect upgrade chip for somebody on an older 12th gen i5 or lower. I wouldn't consider building new with it however.There's a cost to this CPU though. Heat. And power draw. I have an Arctic Liquid Freezer III 360 AIO on this chip, and even with a sizable undervolt, it still throttles at around 230W running 100C. It feels like this chip is almost uncoolable. Unless you go full custom liquid cooling or something. I considered a large air cooler for this chip and I'm glad I went with an AIO. Buyer beware. This thing runs hot. It's also incredibly fast. If you can cool it this thing will fly.",Insane performance at a cost,en,"His processor is a speed demon. Naming, editing, encoding, and whatever else you can think of, it can handle. The performance is there. The value for money is quite good too. Unless you really want top of the line, this chip effectively eliminates the in from consideration. 20 comes. Of and 12E. Boost up to 5.6GHz on 2 threads. I snapped a 12600K for this part and I'm still kind staggered at just how fast it is in heavily treated apes. His is a perfect upgrade chip for somebody on an older with gen in or lower. I wouldn't consider building new with it however.There's a cost to this CPU though. Seat. And power draw. I have an Arctic Liquid Breeze III 360 AIO on this chip, and even with a liable underfoot, it still throttle at around 230W running 100C. It feels like this chip is almost uncoolable. Unless you go full custom liquid cooling or something. I considered a large air cooper for this chip and I'm glad I went with an AIO. Buyer beware. His thing runs hot. It's also incredibly fast. Of you can cool it this thing will fly.",processor speed demon naming editing encoding whatever else think handle performance value money quite good unless really want top line chip effectively eliminates consideration 20 come 12e boost 56ghz 2 thread snapped 12600k part im still kind staggered fast heavily treated ape perfect upgrade chip somebody older gen lower wouldnt consider building new howevertheres cost cpu though seat power draw arctic liquid breeze iii 360 aio chip even liable underfoot still throttle around 230w running 100c feel like chip almost uncoolable unless go full custom liquid cooling something considered large air cooper chip im glad went aio buyer beware thing run hot also incredibly fast cool thing fly,NEGATIVE,"['processor', 'speed', 'demon', 'naming', 'editing', 'encoding', 'whatever', 'else', 'think', 'handle', 'performance', 'value', 'money', 'quite', 'good', 'unless', 'really', 'want', 'top', 'line', 'chip', 'effectively', 'eliminates', 'consideration', '20', 'come', '12e', 'boost', '56ghz', '2', 'thread', 'snapped', '12600k', 'part', 'im', 'still', 'kind', 'staggered', 'fast', 'heavily', 'treated', 'ape', 'perfect', 'upgrade', 'chip', 'somebody', 'older', 'gen', 'lower', 'wouldnt', 'consider', 'building', 'new', 'howevertheres', 'cost', 'cpu', 'though', 'seat', 'power', 'draw', 'arctic', 'liquid', 'breeze', 'iii', '360', 'aio', 'chip', 'even', 'liable', 'underfoot', 'still', 'throttle', 'around', '230w', 'running', '100c', 'feel', 'like', 'chip', 'almost', 'uncoolable', 'unless', 'go', 'full', 'custom', 'liquid', 'cooling', 'something', 'considered', 'large', 'air', 'cooper', 'chip', 'im', 'glad', 'went', 'aio', 'buyer', 'beware', 'thing', 'run', 'hot', 'also', 'incredibly', 'fast', 'cool', 'thing', 'fly']",0.21860443,0.46216232,0.42917758,0.5192701,0.45975906,0.55610996,0.28603712
fourStar,4,"I upgraded from an 8700k to this 14700k nearly 8 years later. Performance-wise, the difference is fairly negligible to me, and that is reflected in the 'real' specs. Going from 6 cores to 20 cores isnt really a 3x+ increase when most of those cores are 'efficiency cores'. User benchmark puts 14700k as only being 47% faster than the 8700k, despite being 8 years and 6 generations apart.The main improvement from my point of view is the reduced idle/casual power use. My UPS tells me that for my 8700k/1070ti system I drew ~0.43 Kw, and my new 14700k/4070ti super draws ~0.31 Kw watching YT, browsing the web (includes fans, monitors, etc).Mostly just wanted more balance for the new graphics card, since that's what does most of the heavy lifting these days anyway. AI image generation/training - GPU, video rendering/editing/transcoding - GPU, even audio processing/correction is done on GPU these days.",Main improvement is lower power cost day-day,en,"I upgrade from an 8700k to this 14700k nearly 8 years later. Performance-wise, the difference is fairly negligible to me, and that is reflected in the 'real' speck. Going from 6 comes to 20 comes isn really a x+ increase when most of those comes are 'efficiency comes'. User benchmark puts 14700k as only being 47% faster than the 8700k, despite being 8 years and 6 generations apart.The main improvement from my point of view is the reduced idle/casual power use. By UPS tells me that for my 8700k/1070ti system I drew ~0.43 W, and my new 14700k/4070ti super draws ~0.31 W watching of, browsing the web (includes fan, monitor, etc).Mostly just wanted more balance for the new graphics card, since that's what does most of the heavy lifting these days anyway. of image generation/training - GPU, video rendering/editing/transuding - GPU, even audit processing/correction is done on GPU these days.",upgrade 8700k 14700k nearly 8 year later performancewise difference fairly negligible reflected real speck going 6 come 20 come really x increase come efficiency come user benchmark put 14700k 47 faster 8700k despite 8 year 6 generation apartthe main improvement point view reduced idlecasual power use ups tell 8700k1070ti system drew 043 w new 14700k4070ti super draw 031 w watching browsing web includes fan monitor etcmostly wanted balance new graphic card since thats doe heavy lifting day anyway image generationtraining gpu video renderingeditingtransuding gpu even audit processingcorrection done gpu day,NEGATIVE,"['upgrade', '8700k', '14700k', 'nearly', '8', 'year', 'later', 'performancewise', 'difference', 'fairly', 'negligible', 'reflected', 'real', 'speck', 'going', '6', 'come', '20', 'come', 'really', 'x', 'increase', 'come', 'efficiency', 'come', 'user', 'benchmark', 'put', '14700k', '47', 'faster', '8700k', 'despite', '8', 'year', '6', 'generation', 'apartthe', 'main', 'improvement', 'point', 'view', 'reduced', 'idlecasual', 'power', 'use', 'ups', 'tell', '8700k1070ti', 'system', 'drew', '043', 'w', 'new', '14700k4070ti', 'super', 'draw', '031', 'w', 'watching', 'browsing', 'web', 'includes', 'fan', 'monitor', 'etcmostly', 'wanted', 'balance', 'new', 'graphic', 'card', 'since', 'thats', 'doe', 'heavy', 'lifting', 'day', 'anyway', 'image', 'generationtraining', 'gpu', 'video', 'renderingeditingtransuding', 'gpu', 'even', 'audit', 'processingcorrection', 'done', 'gpu', 'day']",0.2254115,0.48265564,0.43607467,0.5723722,0.44786668,0.6178169,0.22928609
fourStar,4,I'm using this as a server CPU mostly for the SR-IOV capable GPU stability has been an issue when running windows VM's on proxmox but in light of recent news about mainboard MFG's pushing the CPU too hard out of the box that may be the source of my stability issues as I mostly left the settings OOB for the CPU,Works but not the most stable,en,I'm using this as a server CPU mostly for the of-IOV capable GPU stability has been an issue when running windows of's on promo but in light of recent news about mainboard MFG's pushing the CPU too hard out of the box that may be the source of my stability issues as I mostly left the settings OOB for the CPU,im using server cpu mostly ofiov capable gpu stability ha issue running window ofs promo light recent news mainboard mfgs pushing cpu hard box may source stability issue mostly left setting oob cpu,NEGATIVE,"['im', 'using', 'server', 'cpu', 'mostly', 'ofiov', 'capable', 'gpu', 'stability', 'ha', 'issue', 'running', 'window', 'ofs', 'promo', 'light', 'recent', 'news', 'mainboard', 'mfgs', 'pushing', 'cpu', 'hard', 'box', 'may', 'source', 'stability', 'issue', 'mostly', 'left', 'setting', 'oob', 'cpu']",0.29487315,0.42259073,0.4605498,0.505631,0.35096553,0.51852715,0.35161477
fourStar,4,"I was never a fan of Intel's business models of locking off cores/features to try and upsell the features back to the consumer.......That aside, Intel has always been the leader in the CPU market and while AMD has been making strides in recent years Intel is still the go to for reliability and power.Anyway.... if you have money to burn and need to upgrade due to artificial obsolesces that is the new craze of forcing people to upgrade.... well, this processor will last a long time... or until they just decide it's not capable anymore.","Results are high, like the price!",en,"I was never a fan of Until's business models of locking off comes/features to try and sell the features back to the consumer.......That aside, Until has always been the leader in the CPU market and while AMD has been making strides in recent years Until is still the go to for reliability and power.Anyway.... if you have money to burn and need to upgrade due to artificial obsolesces that is the new crazy of forcing people to upgrade.... well, this processor will last a long time... or until they just decide it's not capable anymore.",wa never fan untils business model locking comesfeatures try sell feature back consumerthat aside ha always leader cpu market amd ha making stride recent year still go reliability poweranyway money burn need upgrade due artificial obsolesces new crazy forcing people upgrade well processor last long time decide capable anymore,NEGATIVE,"['wa', 'never', 'fan', 'untils', 'business', 'model', 'locking', 'comesfeatures', 'try', 'sell', 'feature', 'back', 'consumerthat', 'aside', 'ha', 'always', 'leader', 'cpu', 'market', 'amd', 'ha', 'making', 'stride', 'recent', 'year', 'still', 'go', 'reliability', 'poweranyway', 'money', 'burn', 'need', 'upgrade', 'due', 'artificial', 'obsolesces', 'new', 'crazy', 'forcing', 'people', 'upgrade', 'well', 'processor', 'last', 'long', 'time', 'decide', 'capable', 'anymore']",0.21522321,0.51924336,0.47956446,0.57142866,0.46832544,0.6395772,0.26196027
fourStar,4,"Greaaaaaat, but lacking in presentation.","Stable, fast and great!!",en,"Greaaaaaat, but lacking in presentation.",greaaaaaat lacking presentation,NEGATIVE,"['greaaaaaat', 'lacking', 'presentation']",0.1695553,0.39512306,0.39256498,0.6326063,0.3784229,0.69977164,0.27336964
fourStar,4,"I upgraded from a12700k with asus tuf z690 board and a arctic air 360 AIO. The 12700 K ran at about 50°C gaming.The 14700k runs in the mid 60s. The 12700k Cinebench score and  temp was 22600/71c. The 14700k was 32000/87c . Still below throttling, which is OK according to Intel . When gaming I only see maybe five frames per second faster at 2k res .this is a good chip. Don’t get me wrong. with as many cores as this has, and the speed it should last for a long time, it far exceeds the needs of any. New or future games.",She’s a hot one,en,"I upgrade from a12700k with asks tut z690 board and a arctic air 360 AIO. The 12700 K ran at about 50°C gazing.The 14700k runs in the mid was. The 12700k Cinebench score and  hemp was 22600/c. The 14700k was 32000/c . Still below throttling, which is of according to Until . When gazing I only see maybe five frames per second faster at k yes .this is a good chip. On’t get me wrong. with as many comes as this has, and the speed it should last for a long time, it far exceeds the needs of any. New or future games.",upgrade a12700k asks tut z690 board arctic air 360 aio 12700 k ran 50c gazingthe 14700k run mid wa 12700k cinebench score hemp wa 22600c 14700k wa 32000c still throttling according gazing see maybe five frame per second faster k yes good chip ont get wrong many come ha speed last long time far exceeds need new future game,NEGATIVE,"['upgrade', 'a12700k', 'asks', 'tut', 'z690', 'board', 'arctic', 'air', '360', 'aio', '12700', 'k', 'ran', '50c', 'gazingthe', '14700k', 'run', 'mid', 'wa', '12700k', 'cinebench', 'score', 'hemp', 'wa', '22600c', '14700k', 'wa', '32000c', 'still', 'throttling', 'according', 'gazing', 'see', 'maybe', 'five', 'frame', 'per', 'second', 'faster', 'k', 'yes', 'good', 'chip', 'ont', 'get', 'wrong', 'many', 'come', 'ha', 'speed', 'last', 'long', 'time', 'far', 'exceeds', 'need', 'new', 'future', 'game']",0.1864012,0.34233558,0.3905023,0.47284117,0.4130737,0.5345124,0.27564678
fourStar,4,I had to replace my h60 to get this to run a full benchmark without hitting thermal limit of 100c with no OC. That is under full core usage during 30s intervals.Now that I replaced the cooler with an artic cooler with some kryonaut paste I have it running 5.6 all core with dual core at 5.7 and it maxes out at 87 on furmark,It's a hot one,en,I had to replace my he to get this to run a full benchmark without hitting thermal limit of 100c with no of. That is under full core usage during was intervals.Now that I replaced the cooper with an attic cooper with some kryonaut paste I have it running 5.6 all core with dual core at 5.7 and it taxes out at 87 on furmark,replace get run full benchmark without hitting thermal limit 100c full core usage wa intervalsnow replaced cooper attic cooper kryonaut paste running 56 core dual core 57 tax 87 furmark,NEGATIVE,"['replace', 'get', 'run', 'full', 'benchmark', 'without', 'hitting', 'thermal', 'limit', '100c', 'full', 'core', 'usage', 'wa', 'intervalsnow', 'replaced', 'cooper', 'attic', 'cooper', 'kryonaut', 'paste', 'running', '56', 'core', 'dual', 'core', '57', 'tax', '87', 'furmark']",0.29888868,0.291308,0.42101243,0.5178767,0.4815486,0.62678236,0.30277538
fourStar,4,"Undervolt for best performance. Don’t get me wrong, it’s a very powerful processor. However there’s typically a lot of heat associated. Without undervolting, hitting its 100 degree Celsius cap is easier than it probably should be.",Gets Hot Under Loads,en,"Undervolt for best performance. On’t get me wrong, it’s a very powerful processor. However there’s typically a lot of heat associated. Without undervolting, hitting its 100 degree Celsus cap is easier than it probably should be.",undervolt best performance ont get wrong powerful processor however typically lot heat associated without undervolting hitting 100 degree celsus cap easier probably,POSITIVE,"['undervolt', 'best', 'performance', 'ont', 'get', 'wrong', 'powerful', 'processor', 'however', 'typically', 'lot', 'heat', 'associated', 'without', 'undervolting', 'hitting', '100', 'degree', 'celsus', 'cap', 'easier', 'probably']",0.25207865,0.49387634,0.54536706,0.574804,0.5235731,0.6758912,0.38844234
fourStar,4,Upgrade from an I7 8700 to this. Temps are crazy when gaming but my water cooling setup helps keep it mostly stable.,Decent upgrade over I7 8700,en,Upgrade from an Of 8700 to this. Temps are crazy when gazing but my water cooling set helps keep it mostly stable.,upgrade 8700 temp crazy gazing water cooling set help keep mostly stable,POSITIVE,"['upgrade', '8700', 'temp', 'crazy', 'gazing', 'water', 'cooling', 'set', 'help', 'keep', 'mostly', 'stable']",0.19910255,0.49301004,0.41049406,0.5340251,0.34096265,0.62259674,0.31962937
fourStar,4,THis is a power hungry beast of a processor..under load goes to 280 Watt easy.. had to set the power limits using intel XTU.. but idles at 30n-35 C while browsing and general use... Jumped from a I7 9700 K to this... can see huge difference in gaming else its OK !!,Goes to 100 c with 280 MM AIO cooler,en,his is a power hungry beast of a processor..under load goes to 280 Watt easy.. had to set the power limits using inter XTU.. but idle at in-35 C while browsing and general use... Jumped from a Of 9700 K to this... can see huge difference in gazing else its of !!,power hungry beast processorunder load go 280 watt easy set power limit using inter xtu idle in35 c browsing general use jumped 9700 k see huge difference gazing else,NEGATIVE,"['power', 'hungry', 'beast', 'processorunder', 'load', 'go', '280', 'watt', 'easy', 'set', 'power', 'limit', 'using', 'inter', 'xtu', 'idle', 'in35', 'c', 'browsing', 'general', 'use', 'jumped', '9700', 'k', 'see', 'huge', 'difference', 'gazing', 'else']",0.17551629,0.51937616,0.44809037,0.5491109,0.41343212,0.5802043,0.23633777
oneStar,1,"overall intel is great for a work station, HOWEVER the 14 series is stupid as hell... it offers NO benefit in 99.9% of situations over 13 series... I upgraded from a 12700k, and saw only minor improvements, and at the expense of power cost. My desktop now idles at 150-250 watts... before with my 12700k it was idling at like half that. in most cases a lot of people wont care, however being forced to live in a high cost of living state like CA, where electricity is $0.44 per kwh, that means just idling is costing me 0.11 per hour, that's $1000 a year just in idling... plus all the electricity my house uses. I'm only here temporarily (military) and will be moving as soon as retire, but its something to note.On top of that, its a straight refresh of the older 13th gen, and they blocked APO for the 13th and 12th gen and aren't working on getting it working across the board (only minor useless titles no one honestly cares about)...If it was a bit cheaper to go AMD, I would have went to a 7800x3d, but that would have cost me about 900 just to switch, due to having to buy new RAM (still on DDR4, 3600mhz/CL14) and Motherboard...There's also the constant issue of certain games/programs just refusing to run in Multithread/Multicore, or using the E-cores inappropriately. Intel really needs to sort out this trash...",Horrible Efficiency,en,"overall inter is great for a work station, HOWEVER the 14 series is stupid as hell... it offers of benefit in 99.9% of situations over 13 series... I upgrade from a 12700k, and saw only minor improvements, and at the expense of power cost. By desktop now idle at 150-250 wants... before with my 12700k it was doing at like half that. in most cases a lot of people wont care, however being forced to live in a high cost of living state like of, where electricity is $0.44 per wh, that means just doing is costing me 0.11 per hour, that's $1000 a year just in doing... plus all the electricity my house uses. I'm only here temporarily (military) and will be moving as soon as retire, but its something to note.In top of that, its a straight refresh of the older with gen, and they blocked APO for the with and with gen and aren't working on getting it working across the board (only minor useless titles no one honestly cares about)...Of it was a bit cheaper to go AMD, I would have went to a 7800x3d, but that would have cost me about 900 just to switch, due to having to buy new RAM (still on DDR4, 3600mhz/CL14) and Motherboard...There's also the constant issue of certain games/programs just refusing to run in Multithread/Multicore, or using the E-comes inappropriately. Until really needs to sort out this trash...",overall inter great work station however 14 series stupid hell offer benefit 999 situation 13 series upgrade 12700k saw minor improvement expense power cost desktop idle 150250 want 12700k wa like half case lot people wont care however forced live high cost living state like electricity 044 per wh mean costing 011 per hour thats 1000 year plus electricity house u im temporarily military moving soon retire something notein top straight refresh older gen blocked apo gen arent working getting working across board minor useless title one honestly care aboutof wa bit cheaper go amd would went 7800x3d would cost 900 switch due buy new ram still ddr4 3600mhzcl14 motherboardtheres also constant issue certain gamesprograms refusing run multithreadmulticore using ecomes inappropriately really need sort trash,NEGATIVE,"['overall', 'inter', 'great', 'work', 'station', 'however', '14', 'series', 'stupid', 'hell', 'offer', 'benefit', '999', 'situation', '13', 'series', 'upgrade', '12700k', 'saw', 'minor', 'improvement', 'expense', 'power', 'cost', 'desktop', 'idle', '150250', 'want', '12700k', 'wa', 'like', 'half', 'case', 'lot', 'people', 'wont', 'care', 'however', 'forced', 'live', 'high', 'cost', 'living', 'state', 'like', 'electricity', '044', 'per', 'wh', 'mean', 'costing', '011', 'per', 'hour', 'thats', '1000', 'year', 'plus', 'electricity', 'house', 'u', 'im', 'temporarily', 'military', 'moving', 'soon', 'retire', 'something', 'notein', 'top', 'straight', 'refresh', 'older', 'gen', 'blocked', 'apo', 'gen', 'arent', 'working', 'getting', 'working', 'across', 'board', 'minor', 'useless', 'title', 'one', 'honestly', 'care', 'aboutof', 'wa', 'bit', 'cheaper', 'go', 'amd', 'would', 'went', '7800x3d', 'would', 'cost', '900', 'switch', 'due', 'buy', 'new', 'ram', 'still', 'ddr4', '3600mhzcl14', 'motherboardtheres', 'also', 'constant', 'issue', 'certain', 'gamesprograms', 'refusing', 'run', 'multithreadmulticore', 'using', 'ecomes', 'inappropriately', 'really', 'need', 'sort', 'trash']",0.1896022,0.433756,0.4992858,0.51655954,0.48676854,0.63417506,0.33233428
