filterByRating,ratingScore,reviewDescription,reviewTitle,language,corrected_review,cleaned_review,classification,clean_review2,cpu,speed,processor,upgrade,core,temperature,cost
fiveStar,5,"Upgraded from a really old CPU. It was basically between the 13700k and 14700k, and for a little bit more, I thought why not just get the 14700k. If you're on a budget, then just get the 13700k. There's probably no noticeable difference. It may not be the most efficient CPU, but it just works.","Good CPU, no issues",en,"Degraded from a really old CPU. It was basically between the 13700k and 14700k, and for a little bit more, I thought why not just get the 14700k. Of you're on a budget, then just get the 13700k. There's probably no noticeable difference. It may not be the most efficient CPU, but it just works.",degraded really old cpu wa basically 13700k 14700k little bit thought get 14700k youre budget get 13700k probably noticeable difference may efficient cpu work,POSITIVE,"['degraded', 'really', 'old', 'cpu', 'wa', 'basically', '13700k', '14700k', 'little', 'bit', 'thought', 'get', '14700k', 'youre', 'budget', 'get', '13700k', 'probably', 'noticeable', 'difference', 'may', 'efficient', 'cpu', 'work']",0.20878372,0.33026654,0.28011563,0.4752848,0.3470305,0.5444239,0.23861405
fiveStar,5,I upgraded from an 11900k to this. Huge gains! Pair it with decent hardware and you got a 1440p champ.,Fast!,en,I upgrade from an 11900k to this. Huge gains! Hair it with decent hardware and you got a 1440p champ.,upgrade 11900k huge gain hair decent hardware got 1440p champ,POSITIVE,"['upgrade', '11900k', 'huge', 'gain', 'hair', 'decent', 'hardware', 'got', '1440p', 'champ']",0.2575787,0.32847697,0.39883476,0.6366526,0.386804,0.591632,0.1740184
fiveStar,5,just undervolt to control the temperature my work just fine with -0.080 mv,undervolt and you are done,en,just underfoot to control the temperature my work just fine with -0.080 my,underfoot control temperature work fine 0080,POSITIVE,"['underfoot', 'control', 'temperature', 'work', 'fine', '0080']",0.24455729,0.24653108,0.47068033,0.46169055,0.601372,0.6305205,0.31870985
fiveStar,5,Good!,Good,en,Good!,good,POSITIVE,['good'],-0.08476391,0.037112422,0.20159695,0.16518089,0.28188267,-0.21761845,0.28807473
fiveStar,5,INTEL ES INTEL LO MEJOR DE LO MEJOR,LO MAXIMO,en,INTEL of INTEL of MEJOR of of MEJOR,intel intel mejor mejor,NEGATIVE,"['intel', 'intel', 'mejor', 'mejor']",-0.02191666,0.39663768,0.33057055,0.32488543,0.51972336,0.60376465,0.15704474
fiveStar,5,Great cpu for gaming. No regrets,Love it,en,Great CPU for gazing. To regrets,great cpu gazing regret,POSITIVE,"['great', 'cpu', 'gazing', 'regret']",0.14191705,0.36099955,0.3796291,0.6780616,0.3797894,0.7031731,0.1845819
fiveStar,5,Just Great,Great,en,Must Great,must great,POSITIVE,"['must', 'great']",0.1996588,0.3313783,0.38321817,0.5796084,0.23468888,0.79814774,0.42472562
