filterByRating,ratingScore,reviewDescription,reviewTitle,language,corrected_review,cleaned_review,classification,clean_review2,cpu,speed,processor,upgrade,core,temperature,cost
fiveStar,5,Works as advertised.,Good benchmarking,en,Works as advertised.,work advertised,POSITIVE,"['work', 'advertised']",0.004786061,0.52527875,0.5355168,0.6089503,0.5430457,0.6625176,0.18739979
fiveStar,5,this is kinda good for my GPU,Mid end processor,en,this is kind good for my GPU,kind good gpu,POSITIVE,"['kind', 'good', 'gpu']",0.23835233,0.21069293,0.1702112,0.4385891,0.15797068,0.020279529,0.15778542
fiveStar,5,"This Intel 14700K is phenomenal! Lightning-fast speeds and seamless performance make every task a breeze. Whether I'm gaming, streaming, or working, it handles everything with ease.",Perfect for gaming and streaming in 2024.,en,"His Until 14700K is phenomena! Lightning-fast speed and fearless performance make every task a breeze. Whether I'm gazing, streaming, or working, it candles everything with ease.",14700k phenomenon lightningfast speed fearless performance make every task breeze whether im gazing streaming working candle everything ease,POSITIVE,"['14700k', 'phenomenon', 'lightningfast', 'speed', 'fearless', 'performance', 'make', 'every', 'task', 'breeze', 'whether', 'im', 'gazing', 'streaming', 'working', 'candle', 'everything', 'ease']",0.083063394,0.5888525,0.4860003,0.579267,0.4648344,0.6724193,0.19487038
fiveStar,5,"I guess everyone is right, these things are hot and then some.  I went with a off brand AIO, and for the most part I'm good.  It does get spicy when I'm rendering or doing some crazy multi tasking.Gaming seems fine, no issues.  I play all kinds of games, FPS, MMO's, survival, etc.  (Paired with a Gigabyte Gaming 4090 OC, Tforce 64 gigs 6000 M/T DDR5, samsung 990 pro NVME 2 tb x2, no OCing done by me.)I replaced a 5950x, which was having issues for some reason, just felt like it was getting slower and slower, thermal paste and heat were fine on it, never got over 60c with the beefier AIO I had on it.  Just took longer and longer to render things.  I guess I wore it out!I just think you'll want a good AIO, and/or a solid water cooling solution for this to really get the best out of it.  I'm not sure a air cooled option will do you any good, but hey I've been wrong many times, so there might be something that can handle the job.All in all, not bad, but it's not going to give you much performance boost over last gen, matter of fact I found out later 13700k beats it in a lot of tests, blargh!  Either way, its fast, and it runs everything great, so I'm happy till the next go around.","She's a beast, but so HOT!!",en,"I guess everyone is right, these things are hot and then some.  I went with a off brand AIO, and for the most part I'm good.  It does get spice when I'm rendering or doing some crazy multi taking.Naming seems fine, no issues.  I play all kinds of games, FPS, MMO's, survival, etc.  (Haired with a Gigabyte Naming 4090 of, Force 64 figs 6000 M/T DDR5, samson 990 pro NVME 2 to x, no being done by me.)I replaced a 5950x, which was having issues for some reason, just felt like it was getting slower and slower, thermal paste and heat were fine on it, never got over c with the beecher AIO I had on it.  Must took longer and longer to render things.  I guess I wore it out!I just think you'll want a good AIO, and/or a solid water cooling solution for this to really get the best out of it.  I'm not sure a air cooled option will do you any good, but hey I've been wrong many times, so there might be something that can handle the job.All in all, not bad, but it's not going to give you much performance boost over last gen, matter of fact I found out later 13700k beats it in a lot of tests, large!  Either way, its fast, and it runs everything great, so I'm happy till the next go around.",guess everyone right thing hot went brand aio part im good doe get spice im rendering crazy multi takingnaming seems fine issue play kind game fps mmos survival etc haired gigabyte naming 4090 force 64 fig 6000 mt ddr5 samson 990 pro nvme 2 x done mei replaced 5950x wa issue reason felt like wa getting slower slower thermal paste heat fine never got c beecher aio must took longer longer render thing guess wore outi think youll want good aio andor solid water cooling solution really get best im sure air cooled option good hey ive wrong many time might something handle joball bad going give much performance boost last gen matter fact found later 13700k beat lot test large either way fast run everything great im happy till next go around,POSITIVE,"['guess', 'everyone', 'right', 'thing', 'hot', 'went', 'brand', 'aio', 'part', 'im', 'good', 'doe', 'get', 'spice', 'im', 'rendering', 'crazy', 'multi', 'takingnaming', 'seems', 'fine', 'issue', 'play', 'kind', 'game', 'fps', 'mmos', 'survival', 'etc', 'haired', 'gigabyte', 'naming', '4090', 'force', '64', 'fig', '6000', 'mt', 'ddr5', 'samson', '990', 'pro', 'nvme', '2', 'x', 'done', 'mei', 'replaced', '5950x', 'wa', 'issue', 'reason', 'felt', 'like', 'wa', 'getting', 'slower', 'slower', 'thermal', 'paste', 'heat', 'fine', 'never', 'got', 'c', 'beecher', 'aio', 'must', 'took', 'longer', 'longer', 'render', 'thing', 'guess', 'wore', 'outi', 'think', 'youll', 'want', 'good', 'aio', 'andor', 'solid', 'water', 'cooling', 'solution', 'really', 'get', 'best', 'im', 'sure', 'air', 'cooled', 'option', 'good', 'hey', 'ive', 'wrong', 'many', 'time', 'might', 'something', 'handle', 'joball', 'bad', 'going', 'give', 'much', 'performance', 'boost', 'last', 'gen', 'matter', 'fact', 'found', 'later', '13700k', 'beat', 'lot', 'test', 'large', 'either', 'way', 'fast', 'run', 'everything', 'great', 'im', 'happy', 'till', 'next', 'go', 'around']",0.13474856,0.3924643,0.40020594,0.4976375,0.42100358,0.56625956,0.2684492
fiveStar,5,"Very good processor, upgraded form a very nice Ryzen 1700 (6 years old with me) to this one, decided to go intel due to memory stability. After 3 weeks I can say I love it, very nice temps while gaming and I've received around a 60% improvement in my games (I maintained my RTX3070). I'm currently using a NZXT Kraken Elite 360 AIO to cool it and it has been showing around 50-60 C during high intensive gaming which is very good. Went with this over the 7800X3D since I feel this is more future proof for productivity since I upgrade every 5-6 years. While I know the AM5 socket will last longer, anyways, every time I upgrade I also upgrade the motherboard. Very nice product, will recommend it.",Very good and reliable processor,en,"Very good processor, upgrade form a very nice Dozen 1700 (6 years old with me) to this one, decided to go inter due to memory stability. After 3 weeks I can say I love it, very nice temps while gazing and I've received around a 60% improvement in my games (I maintained my RTX3070). I'm currently using a NZXT Taken Elite 360 AIO to cool it and it has been showing around 50-60 C during high intensive gazing which is very good. Went with this over the 7800X3D since I feel this is more future proof for productivity since I upgrade every 5-6 years. While I know the AM5 socket will last longer, anyway, every time I upgrade I also upgrade the motherboard. Very nice product, will recommend it.",good processor upgrade form nice dozen 1700 6 year old one decided go inter due memory stability 3 week say love nice temp gazing ive received around 60 improvement game maintained rtx3070 im currently using nzxt taken elite 360 aio cool ha showing around 5060 c high intensive gazing good went 7800x3d since feel future proof productivity since upgrade every 56 year know am5 socket last longer anyway every time upgrade also upgrade motherboard nice product recommend,POSITIVE,"['good', 'processor', 'upgrade', 'form', 'nice', 'dozen', '1700', '6', 'year', 'old', 'one', 'decided', 'go', 'inter', 'due', 'memory', 'stability', '3', 'week', 'say', 'love', 'nice', 'temp', 'gazing', 'ive', 'received', 'around', '60', 'improvement', 'game', 'maintained', 'rtx3070', 'im', 'currently', 'using', 'nzxt', 'taken', 'elite', '360', 'aio', 'cool', 'ha', 'showing', 'around', '5060', 'c', 'high', 'intensive', 'gazing', 'good', 'went', '7800x3d', 'since', 'feel', 'future', 'proof', 'productivity', 'since', 'upgrade', 'every', '56', 'year', 'know', 'am5', 'socket', 'last', 'longer', 'anyway', 'every', 'time', 'upgrade', 'also', 'upgrade', 'motherboard', 'nice', 'product', 'recommend']",0.18220629,0.431148,0.41331416,0.5276843,0.47271648,0.5557934,0.23045793
fiveStar,5,Was going to wait until 15th gen to upgrade my 10900k but decided to go for it. While the 10900k is still a powerhouse this is a good upgrade and I am happy with. This processor is ridiculously fast and handles everything we would expect it to. Cyberpunk picked up 10fps with a 3080 but runs super smooth now at 4k with RT. I did pair this with a z790 Aorus and 32gb ddr5 6400.******** AT Own Risk*******  Suggest undervolting in bios if you know what you are doing. I am running this cpu 5.7 all cores - 1.24v on a custom loop. I see idle temps 31c - gaming 60c and cinebench 89c.  It will run hot if you're on air and do not adjust the default voltage. There are plenty of youtube videos out there as a resource.  Overall great processor,Worth it if <13th gen,en,Was going to wait until with gen to upgrade my 10900k but decided to go for it. While the 10900k is still a poorhouse this is a good upgrade and I am happy with. His processor is ridiculously fast and candles everything we would expect it to. Cyberpunk picked up 10fps with a 3080 but runs super smooth now at k with of. I did pair this with a z790 Words and 32gb dark 6400.******** of Own Risk*******  Suggest undervolting in bits if you know what you are doing. I am running this CPU 5.7 all comes - 1.iv on a custom loop. I see idle temps c - gazing c and cinebench c.  It will run hot if you're on air and do not adjust the default voltage. There are plenty of couture video out there as a resource.  Overall great processor,wa going wait gen upgrade 10900k decided go 10900k still poorhouse good upgrade happy processor ridiculously fast candle everything would expect cyberpunk picked 10fps 3080 run super smooth k pair z790 word 32gb dark 6400 risk suggest undervolting bit know running cpu 57 come 1iv custom loop see idle temp c gazing c cinebench c run hot youre air adjust default voltage plenty couture video resource overall great processor,POSITIVE,"['wa', 'going', 'wait', 'gen', 'upgrade', '10900k', 'decided', 'go', '10900k', 'still', 'poorhouse', 'good', 'upgrade', 'happy', 'processor', 'ridiculously', 'fast', 'candle', 'everything', 'would', 'expect', 'cyberpunk', 'picked', '10fps', '3080', 'run', 'super', 'smooth', 'k', 'pair', 'z790', 'word', '32gb', 'dark', '6400', 'risk', 'suggest', 'undervolting', 'bit', 'know', 'running', 'cpu', '57', 'come', '1iv', 'custom', 'loop', 'see', 'idle', 'temp', 'c', 'gazing', 'c', 'cinebench', 'c', 'run', 'hot', 'youre', 'air', 'adjust', 'default', 'voltage', 'plenty', 'couture', 'video', 'resource', 'overall', 'great', 'processor']",0.3010795,0.4158494,0.47621098,0.5452103,0.45505226,0.5319296,0.31759912
fiveStar,5,"This new Intel® Core™ i7-14700K New Gaming Desktop Processor with 20 cores just rocks! Cooling it with an Noctua NH-U12A, Premium CPU Cooler with High-Performance Quiet NF-A12x25 PWM Fans (120mm, Brown) for Desktop.",Intel® Core™ i7-14700K,en,"His new Until® More™ in-14700K New Naming Desktop Processor with 20 comes just rocks! Cooling it with an Noctua of-U12A, Premium CPU Sooner with High-Performance Quiet of-A12x25 PWM Dans (120mm, Grown) for Desktop.",new in14700k new naming desktop processor 20 come rock cooling noctua ofu12a premium cpu sooner highperformance quiet ofa12x25 pwm dans 120mm grown desktop,POSITIVE,"['new', 'in14700k', 'new', 'naming', 'desktop', 'processor', '20', 'come', 'rock', 'cooling', 'noctua', 'ofu12a', 'premium', 'cpu', 'sooner', 'highperformance', 'quiet', 'ofa12x25', 'pwm', 'dans', '120mm', 'grown', 'desktop']",0.31199437,0.35296312,0.54430604,0.4848814,0.52728695,0.48893854,0.35779533
fiveStar,5,"WoW! What a beast, intel i7 14700K! it can handle any tasks in pc as game and everyday use.  No issues with it. Thanks for fast shipping!","WoW, Powerful processor from Intel",en,"of! That a beast, inter in 14700K! it can handle any tasks in pp as game and everyday use.  To issues with it. Thanks for fast shipping!",beast inter 14700k handle task pp game everyday use issue thanks fast shipping,POSITIVE,"['beast', 'inter', '14700k', 'handle', 'task', 'pp', 'game', 'everyday', 'use', 'issue', 'thanks', 'fast', 'shipping']",0.2561382,0.5932377,0.46247786,0.5888973,0.25628185,0.63466305,0.2963866
fiveStar,5,"I never had a CPU on my hands before so i was really stressed out about it 😅, but i was able to mount it and it was the easiest part of my PC built, i don't have any idea about its perfomance yet and for now i just can say that in bios mode it keeps under 95°F with the AIO cooler, i will update eventualy when i finish the OS instalation",Nicee!!!,en,"I never had a CPU on my hands before so i was really stressed out about it 😅, but i was able to mount it and it was the easiest part of my of built, i don't have any idea about its performance yet and for now i just can say that in bits mode it keeps under 95°F with the AIO cooper, i will update eventually when i finish the of installation",never cpu hand wa really stressed wa able mount wa easiest part built dont idea performance yet say bit mode keep 95f aio cooper update eventually finish installation,NEGATIVE,"['never', 'cpu', 'hand', 'wa', 'really', 'stressed', 'wa', 'able', 'mount', 'wa', 'easiest', 'part', 'built', 'dont', 'idea', 'performance', 'yet', 'say', 'bit', 'mode', 'keep', '95f', 'aio', 'cooper', 'update', 'eventually', 'finish', 'installation']",0.23596513,0.4968053,0.40877378,0.5464191,0.38821018,0.64312917,0.26305994
fiveStar,5,"They say the intel 14th gen chips run hot. If thats true then the AMD Ryzen 7 3700x's run as hot as the sun because this chip is cooler than the AMD chips.It does draw a lot of power, but it has like 20 cores. Totally worth it.",14th Gen + Asrock Z790 Steel Legend Wifi = Perfect in any Unraid server,en,"They say the inter with gen chips run hot. Of that true then the AMD Dozen 7 3700x's run as hot as the sun because this chip is cooper than the AMD chips.It does draw a lot of power, but it has like 20 comes. Totally worth it.",say inter gen chip run hot true amd dozen 7 3700xs run hot sun chip cooper amd chipsit doe draw lot power ha like 20 come totally worth,POSITIVE,"['say', 'inter', 'gen', 'chip', 'run', 'hot', 'true', 'amd', 'dozen', '7', '3700xs', 'run', 'hot', 'sun', 'chip', 'cooper', 'amd', 'chipsit', 'doe', 'draw', 'lot', 'power', 'ha', 'like', '20', 'come', 'totally', 'worth']",0.23863752,0.28194296,0.41220284,0.417124,0.44125694,0.48413208,0.3309942
fiveStar,5,Built a new system with the 14700k for photo/video editing and some gaming. Decided to go with the 14th gen i7 instead of the 13th gen since it's the only series that had a noticeable improvement (4 more e cores and threads). Very fast for video editing and overkill for most gaming. Absolutely love it! I keep it cool with a 360mm AIO and a contact plate for even lower temperatures.Avg Temps:100% Load - Low 70'sGaming - Mid to High 40's (Low 50's for more demading titles)Idle & Browsing - Mid 20's,Great Performance,en,Built a new system with the 14700k for photo/video editing and some gazing. Decided to go with the with gen in instead of the with gen since it's the only series that had a noticeable improvement (4 more e comes and threads). Very fast for video editing and overall for most gazing. Absolutely love it! I keep it cool with a 360mm AIO and a contact plate for even lower temperatures.Fig Temps:100% Road - Now 70'saying - Did to High 40's (Now 50's for more demanding titles)Idle & Drowsing - Did 20's,built new system 14700k photovideo editing gazing decided go gen instead gen since series noticeable improvement 4 e come thread fast video editing overall gazing absolutely love keep cool 360mm aio contact plate even lower temperaturesfig temps100 road 70saying high 40 50 demanding titlesidle drowsing 20,POSITIVE,"['built', 'new', 'system', '14700k', 'photovideo', 'editing', 'gazing', 'decided', 'go', 'gen', 'instead', 'gen', 'since', 'series', 'noticeable', 'improvement', '4', 'e', 'come', 'thread', 'fast', 'video', 'editing', 'overall', 'gazing', 'absolutely', 'love', 'keep', 'cool', '360mm', 'aio', 'contact', 'plate', 'even', 'lower', 'temperaturesfig', 'temps100', 'road', '70saying', 'high', '40', '50', 'demanding', 'titlesidle', 'drowsing', '20']",0.13898572,0.52611345,0.3912158,0.52764994,0.40664825,0.5704102,0.27792782
fiveStar,5,"I bought it to do computations on all cores. The best value for money I could find. Requires custom loop, delliding if you want to run high boost on all cores for long periods of time. The chip is hot. I will probably drop boost clocks and undervolt to stay cool. Using Acrtic Freezer II 360.",20 modern cores per $400,en,"I bought it to do amputations on all comes. The best value for money I could find. Requires custom loop, deciding if you want to run high boost on all comes for long periods of time. The chip is hot. I will probably drop boost clocks and underfoot to stay cool. Using Aortic Breeze of 360.",bought amputation come best value money could find requires custom loop deciding want run high boost come long period time chip hot probably drop boost clock underfoot stay cool using aortic breeze 360,NEGATIVE,"['bought', 'amputation', 'come', 'best', 'value', 'money', 'could', 'find', 'requires', 'custom', 'loop', 'deciding', 'want', 'run', 'high', 'boost', 'come', 'long', 'period', 'time', 'chip', 'hot', 'probably', 'drop', 'boost', 'clock', 'underfoot', 'stay', 'cool', 'using', 'aortic', 'breeze', '360']",0.2752538,0.31201035,0.43780464,0.43186584,0.4843598,0.46295476,0.39714754
fiveStar,5,It's been great so far. Clocking right and no overheating. Currently paired with a phanteks 360mm AIO.,Solid CPU,en,It's been great so far. Blocking right and no overhearing. Currently haired with a planters 360mm AIO.,great far blocking right overhearing currently haired planter 360mm aio,NEGATIVE,"['great', 'far', 'blocking', 'right', 'overhearing', 'currently', 'haired', 'planter', '360mm', 'aio']",0.11727205,0.2748591,0.43724096,0.5887073,0.54368925,0.67690074,0.16260412
fiveStar,5,"It makes a good pair with the RTX 4070 Ti Super, but you need a suitable cooler!  With Be Quiet Dark Rock 4 Pro I manage to keep it at 60 maximum 70 degrees in games!",I7 14700k,en,"It makes a good pair with the RTX 4070 I Super, but you need a suitable cooper!  With He Quiet Dark Lock 4 Fro I manage to keep it at 60 maximum 70 degrees in games!",make good pair rtx 4070 super need suitable cooper quiet dark lock 4 fro manage keep 60 maximum 70 degree game,POSITIVE,"['make', 'good', 'pair', 'rtx', '4070', 'super', 'need', 'suitable', 'cooper', 'quiet', 'dark', 'lock', '4', 'fro', 'manage', 'keep', '60', 'maximum', '70', 'degree', 'game']",0.17164901,0.39988667,0.42044273,0.55602235,0.46727443,0.61532736,0.18502846
fiveStar,5,"I was using a 10700K. I decided it was time..well, actually I got the itch.I decided to go with the 14700K for a few reasons. One is that it's the only 14th gen part from Intel that got a significant upgrade (four more e-cores and 8 more threads, plus a small clock boost).I also don't like that the 3DFX part from AMD had caused some minor issues for people, and I definitely don't like the RAM issues I see all the time on AMD systems. If it wasn't for the RAM issues, I may have gone AMD this time. Out of all the Intel systems I have assembled for customers over the years, I have not once come across a RAM issue that wasn't caused by bad RAM.This CPU is working perfectly, and gaming excellently. Gaming benchmarks show it to be a very good CPU, and I am not having any issues with it.If you are interested in any other Intel parts, I suggest going with 13th gen as you will basically get the same part for less money. For an i7 system though, this is an excellent CPU and a half decent upgrade over the previous gen.",The only real upgraded 14th gen part,en,"I was using a 10700K. I decided it was time..well, actually I got the pitch.I decided to go with the 14700K for a few reasons. One is that it's the only with gen part from Until that got a significant upgrade (four more e-comes and 8 more threads, plus a small clock boost).I also don't like that the 3DFX part from AMD had caused some minor issues for people, and I definitely don't like the RAM issues I see all the time on AMD systems. Of it wasn't for the RAM issues, I may have gone AMD this time. But of all the Until systems I have assembled for customers over the years, I have not once come across a RAM issue that wasn't caused by bad RAM.His CPU is working perfectly, and gazing excellency. Naming benchmarks show it to be a very good CPU, and I am not having any issues with it.Of you are interested in any other Until parts, I suggest going with with gen as you will basically get the same part for less money. For an in system though, this is an excellent CPU and a half decent upgrade over the previous gen.",wa using 10700k decided wa timewell actually got pitchi decided go 14700k reason one gen part got significant upgrade four ecomes 8 thread plus small clock boosti also dont like 3dfx part amd caused minor issue people definitely dont like ram issue see time amd system wasnt ram issue may gone amd time system assembled customer year come across ram issue wasnt caused bad ramhis cpu working perfectly gazing excellency naming benchmark show good cpu issue itof interested part suggest going gen basically get part le money system though excellent cpu half decent upgrade previous gen,POSITIVE,"['wa', 'using', '10700k', 'decided', 'wa', 'timewell', 'actually', 'got', 'pitchi', 'decided', 'go', '14700k', 'reason', 'one', 'gen', 'part', 'got', 'significant', 'upgrade', 'four', 'ecomes', '8', 'thread', 'plus', 'small', 'clock', 'boosti', 'also', 'dont', 'like', '3dfx', 'part', 'amd', 'caused', 'minor', 'issue', 'people', 'definitely', 'dont', 'like', 'ram', 'issue', 'see', 'time', 'amd', 'system', 'wasnt', 'ram', 'issue', 'may', 'gone', 'amd', 'time', 'system', 'assembled', 'customer', 'year', 'come', 'across', 'ram', 'issue', 'wasnt', 'caused', 'bad', 'ramhis', 'cpu', 'working', 'perfectly', 'gazing', 'excellency', 'naming', 'benchmark', 'show', 'good', 'cpu', 'issue', 'itof', 'interested', 'part', 'suggest', 'going', 'gen', 'basically', 'get', 'part', 'le', 'money', 'system', 'though', 'excellent', 'cpu', 'half', 'decent', 'upgrade', 'previous', 'gen']",0.23960169,0.51621616,0.45539117,0.5464587,0.3964402,0.5818438,0.33456057
fiveStar,5,"Arrived earlier than expected, a very good Cpu. Expansive but what could we do.",fast delivery,en,"Arrived earlier than expected, a very good You. Expensive but what could we do.",arrived earlier expected good expensive could,NEGATIVE,"['arrived', 'earlier', 'expected', 'good', 'expensive', 'could']",0.16134456,0.66777724,0.5076398,0.65346986,0.5979442,0.6339467,0.1582695
fiveStar,5,"Haven't installed yet but looks fine. Die size is 30x40 mm, meaning 0,3 ml/0,8 g is the perfect amount of thermal paste (not included). I'll put 5 dots.",Looks good,en,"Haven't installed yet but looks fine. Lie size is 30x40 mm, meaning 0,3 my/0,8 g is the perfect amount of thermal paste (not included). I'll put 5 dots.",havent installed yet look fine lie size 30x40 mm meaning 03 my08 g perfect amount thermal paste included ill put 5 dot,POSITIVE,"['havent', 'installed', 'yet', 'look', 'fine', 'lie', 'size', '30x40', 'mm', 'meaning', '03', 'my08', 'g', 'perfect', 'amount', 'thermal', 'paste', 'included', 'ill', 'put', '5', 'dot']",0.204803,0.4028233,0.2555501,0.42977124,0.29286343,0.530781,0.23765695
fiveStar,5,Super easy to install. Just update your motherboard bios to support 14 Gen,Love it,en,Super easy to install. Must update your motherboard bits to support 14 Men,super easy install must update motherboard bit support 14 men,NEGATIVE,"['super', 'easy', 'install', 'must', 'update', 'motherboard', 'bit', 'support', '14', 'men']",0.37843233,0.48567817,0.519837,0.5958579,0.34789282,0.7132361,0.38638064
fiveStar,5,I decided against the i9 because of cost difference.  For my normal usage I use less than 2% of this CPU.  But I'm really happy with the speed and performance.,Fantastic CPU for the price.,en,I decided against the in because of cost difference.  For my normal usage I use less than 2% of this CPU.  But I'm really happy with the speed and performance.,decided cost difference normal usage use le 2 cpu im really happy speed performance,POSITIVE,"['decided', 'cost', 'difference', 'normal', 'usage', 'use', 'le', '2', 'cpu', 'im', 'really', 'happy', 'speed', 'performance']",0.3248313,0.6265503,0.519319,0.6217774,0.49360672,0.61643374,0.22646803
