"country","countryCode","date","filterByKeyword","filterByRating","isVerified","position","product/listPrice","product/price","productAsin","ratingScore","reviewCategoryUrl","reviewDescription","reviewId","reviewImages/0","reviewImages/1","reviewImages/2","reviewReaction","reviewTitle","reviewUrl","reviewedIn","totalCategoryRatings","totalCategoryReviews","variant","variantAsin"
"India",,"2022-07-03",,"fiveStar","false","2",,,"B08LKJPR5X","5","https://www.amazon.in/product-reviews/B08LKJPR5X?pageNumber=3&filterByStar=five_star&sortBy=helpful&formatType=all_formats&language=en","purchased from local store at Rs 5600/- , all games runs smoothly without any bottleneck with gtx 1660 ti. easily handle and kind of game. best for budget pc build and good gaming experience.","R2C8V5WCDNQ4W6",,,,"3 people found this helpful","best budget gaming king processor.","https://www.amazon.in/gp/customer-reviews/R2C8V5WCDNQ4W6/ref=cm_cr_arp_d_rvw_ttl?ie=UTF8&ASIN=B08LKJPR5X","Reviewed in India on 3 July 2022","2144","192","Pattern Name: Processor","B08LKJPR5X"
"India",,"2021-08-19",,"fiveStar","true","3",,,"B08LKJPR5X","5","https://www.amazon.in/product-reviews/B08LKJPR5X?pageNumber=3&filterByStar=five_star&sortBy=helpful&formatType=all_formats&language=en","Good","R1Y7UNZNOCJ35L",,,,"2 people found this helpful","Nice","https://www.amazon.in/gp/customer-reviews/R1Y7UNZNOCJ35L/ref=cm_cr_arp_d_rvw_ttl?ie=UTF8&ASIN=B08LKJPR5X","Reviewed in India on 19 August 2021","2144","192","Pattern Name: Processor","B08LKJPR5X"
"India",,"2022-07-13",,"fiveStar","true","4",,,"B08LKJPR5X","5","https://www.amazon.in/product-reviews/B08LKJPR5X?pageNumber=3&filterByStar=five_star&sortBy=helpful&formatType=all_formats&language=en","I am used processer is working properly . 3.6gh speed . 4 logical processer and 8 thread processer show . But vga and hdmi not working . This processer . Use graphic card required. I am used graphic card and property working all functions","R3M03IWOFQFN7S",,,,"3 people found this helpful","Good Processer. But graphic card required. 4 logical processer and 8 thread processer","https://www.amazon.in/gp/customer-reviews/R3M03IWOFQFN7S/ref=cm_cr_arp_d_rvw_ttl?ie=UTF8&ASIN=B08LKJPR5X","Reviewed in India on 13 July 2022","2144","192","Pattern Name: Processor","B08LKJPR5X"
"Italy",,"2022-09-18",,"fiveStar","true","5",,,"B08LKJPR5X","5","https://www.amazon.in/product-reviews/B08LKJPR5X?pageNumber=3&filterByStar=five_star&sortBy=helpful&formatType=all_formats&language=en","Ottimo processore, rapporto qualità prezzo imbattibile. Molti lo giudicano male, ma pagare questo gioiellino intorno alle 50-60 euro per avere un processore nuovo in grado di battere processori usati chissà quanti anni venduti al doppio non è una cosa trascurabile","RCVJ9608O01UM",,,,"","Il migliore nella sua fascia di prezzo",,"Reviewed in Italy on 18 September 2022","2144","192","Pattern Name: Processor","B08LKJPR5X"
"Brazil",,"2023-01-11",,"fiveStar","true","6",,,"B08LKJPR5X","5","https://www.amazon.in/product-reviews/B08LKJPR5X?pageNumber=3&filterByStar=five_star&sortBy=helpful&formatType=all_formats&language=en","O processador chegou rapidamente, em apenas 1 dia. Esse é o melhor i3, não tem placa de vídeo integrada, mas compensa muito no resto.Para quem tem uma placa de média, como eu, vai acabar tendo a combinação perfeita.","R1LJBGS6BR95XJ",,,,"","O MELHOR I3",,"Reviewed in Brazil on 11 January 2023","2144","192","Pattern Name: Processor","B08LKJPR5X"
"Australia",,"2021-09-06",,"fiveStar","true","7",,,"B08LKJPR5X","5","https://www.amazon.in/product-reviews/B08LKJPR5X?pageNumber=3&filterByStar=five_star&sortBy=helpful&formatType=all_formats&language=en","I ordered on the Thursday, got here on Saturday. CRAZY FAST DELIVERY. With no compromise on the quality of the product. Amazon prime #1","R1HMDRXJ0YG81Z",,,,"","Got here EARLY and SAFE",,"Reviewed in Australia on 6 September 2021","2144","192","Pattern Name: Processor","B08LKJPR5X"
"United Kingdom",,"2022-05-15",,"fiveStar","true","8",,,"B08LKJPR5X","5","https://www.amazon.in/product-reviews/B08LKJPR5X?pageNumber=3&filterByStar=five_star&sortBy=helpful&formatType=all_formats&language=en","Great budget gaming cpu and actually at the moment better value for money than  the equivalent ryzen. However if your doing editing or streaming or more workstation stuff spend a little extra and get a i5 of the same or 11th gen to get the 6 cores. Honestly go with amd or Intel whatever beats whatever at price performance for your budget, but intel beats amd here on budget for once.","R1NLFNDQBNLX4U",,,,"8 people found this helpful","Excellent gaming upgrade from my ancient but reliable i5-3330",,"Reviewed in the United Kingdom on 15 May 2022","2144","192","Pattern Name: Processor","B08LKJPR5X"
"Japan",,"2024-04-11",,"fiveStar","true","9",,,"B08LKJPR5X","5","https://www.amazon.in/product-reviews/B08LKJPR5X?pageNumber=3&filterByStar=five_star&sortBy=helpful&formatType=all_formats&language=en","知識が無かったため F のタイプを購入してしまいました。映像が出なかったので何故だと思いましたが、調べた結果納得　今は順調に使用してます。","RRRXRMPH46GSO",,,,"","CPU",,"Reviewed in Japan on 11 April 2024","2144","192","Pattern Name: Processor","B08LKJPR5X"
"Canada",,"2022-10-03",,"fiveStar","true","10",,,"B08LKJPR5X","5","https://www.amazon.in/product-reviews/B08LKJPR5X?pageNumber=3&filterByStar=five_star&sortBy=helpful&formatType=all_formats&language=en","great budget CPU for gaming and streaming Fast and zippy does very well with a MSI MPG Z490 Wifi motherboard (just set memory too 3200MHZ in Bios) and M.2 NVME 1TB Timetech , 16gb 3000MHZ ram DDR4 Gskill Aegis and i paired it with a RTX 2060 6GB and it does not bottleneck or disappoint at all in this setup i get a steady 165-175FPS all high settings in Fortnite chapter 3 1080P HD- 3D setting too 80% and 120-165FPS in all high settings in Call of duty WarZone !!! this CPU is GREAT, it is better then a Ryzen 7 1700X or R5 2200G bye far the extra cores dont match the i3 10100F,s better instruction set and higher core clock out of box the 6MB cache only hinders this i3 for video editing but not streaming too twitch or youtube . if you want too future proof for later get a Z590 motherboard too upgrade too 11th gen later when you can afford it and gain all the benefits PCIexpress 4.0 .. this CPU makes all the previous gen 4 core 8 thread cpuz obsolete like the i7 7700 and below and devalued as this is faster and better and has a upgrade path for only 95$ !!! you guys had too upgrade platforms someday and well this is so affordable you should do it now .. the F Sku at the end of i3 10100F means their is no onboard graphics thus you need a GPU or graphics card which Gamers and enthusiasts will anyways","R1MMYG0NG1E6F6",,,,"2 people found this helpful","Best Budget Gaming CPU 2022",,"Reviewed in Canada on 3 October 2022","2144","192","Pattern Name: Processor","B08LKJPR5X"
"United States",,"2022-05-26",,"fourStar","true","1",,,"B08LKJPR5X","4","https://www.amazon.in/product-reviews/B08LKJPR5X?pageNumber=3&filterByStar=four_star&sortBy=helpful&formatType=all_formats&language=en","Paired it with a gtx 1050, for my younger brothers pc. It runs Fortnite, Minecraft, Roblox, COD warzone with ease. Great for the price, happy buyer.","R2UKRWO89C5VJS",,,,"One person found this helpful","Running games great.",,"Reviewed in the United States on 26 May 2022","352","36","Pattern Name: Processor","B08LKJPR5X"
"United States",,"2022-11-18",,"fourStar","true","2",,,"B08LKJPR5X","4","https://www.amazon.in/product-reviews/B08LKJPR5X?pageNumber=3&filterByStar=four_star&sortBy=helpful&formatType=all_formats&language=en","IT WORKS THEREFORE IT DOES ITS JOB","RIO5M6A9W3BMI",,,,"","it a cpu alright!",,"Reviewed in the United States on 18 November 2022","352","36","Pattern Name: Processor","B08LKJPR5X"
"United States",,"2022-01-17",,"fourStar","true","3",,,"B08LKJPR5X","4","https://www.amazon.in/product-reviews/B08LKJPR5X?pageNumber=3&filterByStar=four_star&sortBy=helpful&formatType=all_formats&language=en","llegó sin abolladuras ni maltrato, la caja incluye el procesador, su disipador de stock con pasta térmica pre-aplicada y su manual de uso.","R2N72ODWNI23XW",,,,"","Producto fiel a la imagen",,"Reviewed in the United States on 17 January 2022","352","36","Pattern Name: Processor","B08LKJPR5X"
"United States",,"2022-10-01",,"fourStar","true","4",,,"B08LKJPR5X","4","https://www.amazon.in/product-reviews/B08LKJPR5X?pageNumber=3&filterByStar=four_star&sortBy=helpful&formatType=all_formats&language=en","It works good","RPDDX3M19ZICB",,,,"","You get what you pay for",,"Reviewed in the United States on 1 October 2022","352","36","Pattern Name: Processor","B08LKJPR5X"
"United States",,"2022-03-12",,"fourStar","true","5",,,"B08LKJPR5X","4","https://www.amazon.in/product-reviews/B08LKJPR5X?pageNumber=3&filterByStar=four_star&sortBy=helpful&formatType=all_formats&language=en","it did not work for me but amazon made it right","R3RMEUL1IEROO9",,,,"","thanks amazon",,"Reviewed in the United States on 12 March 2022","352","36","Pattern Name: Processor","B08LKJPR5X"
"Canada",,"2021-11-07",,"fourStar","true","6",,,"B08LKJPR5X","4","https://www.amazon.in/product-reviews/B08LKJPR5X?pageNumber=3&filterByStar=four_star&sortBy=helpful&formatType=all_formats&language=en","Ok","R39D6CS96LU8C8",,,,"","Ok",,"Reviewed in Canada on 7 November 2021","352","36","Pattern Name: Processor","B08LKJPR5X"
"United States",,"2021-10-27",,"fourStar","true","7",,,"B08LKJPR5X","4","https://www.amazon.in/product-reviews/B08LKJPR5X?pageNumber=3&filterByStar=four_star&sortBy=helpful&formatType=all_formats&language=en","Good!","RHFM12Q1JOTZA",,,,"","Good",,"Reviewed in the United States on 27 October 2021","352","36","Pattern Name: Processor","B08LKJPR5X"
"Japan",,"2021-05-27",,"fourStar","true","8",,,"B08LKJPR5X","4","https://www.amazon.in/product-reviews/B08LKJPR5X?pageNumber=3&filterByStar=four_star&sortBy=helpful&formatType=all_formats&language=en","第２世代　i5 2500からの更新です。ＣＰＵの性能には　不満はなかったのですがWindows10を使用するにあたり　起動等での待機時間が酷くなり　第２世代チップセットによる　Ｈ６１でのsata2のSSDへの更新による費用効果が余り期待できず　チップセットを更新する運びとなりました。i5からのグレードダウンに抵抗がありましたがエンコードなどは　やっていませんが不満はありません。もう少し使い込んでレビューしたいと思います。安価にシステム更新するなら　コスパ的に良いと思います。","R2QQJDJPL0IAE2",,,,"One person found this helpful","システム更新で",,"Reviewed in Japan on 27 May 2021","352","36","Pattern Name: Processor","B08LKJPR5X"
"Japan",,"2021-08-30",,"fourStar","true","9",,,"B08LKJPR5X","4","https://www.amazon.in/product-reviews/B08LKJPR5X?pageNumber=3&filterByStar=four_star&sortBy=helpful&formatType=all_formats&language=en","以前は4770を使用してました。i7から最新世代一つ前とはいえi3に変えるのは無謀かなと思いましたが、結果は大変満足しています。テレワーク需要でもっと自宅でPC使うために自作を始める方もいらっしゃると思いますが、動画編集等はせず普段使いやエクセルやワードなどのOfficeソフトを使用目的ならこちらのi3でも十分に思えますね。","R3R6GLOO8MC9W3",,,,"2 people found this helpful","普段使いやOffice使用目的なら是非おすすめ",,"Reviewed in Japan on 30 August 2021","352","36","Pattern Name: Processor","B08LKJPR5X"
"United States",,"2021-03-29",,"fourStar","true","10",,,"B08LKJPR5X","4","https://www.amazon.in/product-reviews/B08LKJPR5X?pageNumber=3&filterByStar=four_star&sortBy=helpful&formatType=all_formats&language=en","GOOD FOR THE MONEY","RG27ZHBVK1V5Z",,,,"","Nice",,"Reviewed in the United States on 29 March 2021","352","36","Pattern Name: Processor","B08LKJPR5X"
"Brazil",,"2022-12-30",,"fourStar","true","1",,,"B08LKJPR5X","4","https://www.amazon.in/product-reviews/B08LKJPR5X?pageNumber=2&filterByStar=four_star&sortBy=helpful&formatType=all_formats&language=en","Chegou, estou feliz com o produto.","R3G9WTF0972IJU",,,,"","Chegou em 8 dias úteis",,"Reviewed in Brazil on 30 December 2022","352","36","Pattern Name: Processor","B08LKJPR5X"
"United States",,"2024-04-14",,"fourStar","true","2",,,"B08LKJPR5X","4","https://www.amazon.in/product-reviews/B08LKJPR5X?pageNumber=2&filterByStar=four_star&sortBy=helpful&formatType=all_formats&language=en","I have had this one installed for about a year now and I am quite satisfied. It does not have integrated graphics so you will need a dedicated GPU card. I paired this CPU with an AMD RX 6500 XT and I can easily do light to medium gaming without any issues.","R2IMAYT0ZKQ8CT",,,,"","A Nice Budget CPU",,"Reviewed in the United States on 14 April 2024","352","36","Pattern Name: Processor","B08LKJPR5X"
"Japan",,"2022-02-13",,"fourStar","true","3",,,"B08LKJPR5X","4","https://www.amazon.in/product-reviews/B08LKJPR5X?pageNumber=2&filterByStar=four_star&sortBy=helpful&formatType=all_formats&language=en","グラボを追加で積まないといけないモデルなので、そこだけ注意すれば全く問題ないです","R3U77E6VEWG1LO",,,,"3 people found this helpful","注意点",,"Reviewed in Japan on 13 February 2022","352","36","Pattern Name: Processor","B08LKJPR5X"
"Brazil",,"2022-09-27",,"fourStar","true","4",,,"B08LKJPR5X","4","https://www.amazon.in/product-reviews/B08LKJPR5X?pageNumber=2&filterByStar=four_star&sortBy=helpful&formatType=all_formats&language=en","Velocidade nativa e conjunto de instruções, apesar de exigir placa de vídeo","R12CZ4PE67RKPH",,,,"","Velocidade excelente! Necessita placa de vídeo adicional",,"Reviewed in Brazil on 27 September 2022","352","36","Pattern Name: Processor","B08LKJPR5X"
"United States",,"2023-08-03",,"fourStar","true","5",,,"B08LKJPR5X","4","https://www.amazon.in/product-reviews/B08LKJPR5X?pageNumber=2&filterByStar=four_star&sortBy=helpful&formatType=all_formats&language=en","It brings my cpu usage up to 70-100 when i game but it is fine","R1WD5SW3CGV1DH",,,,"","Good",,"Reviewed in the United States on 3 August 2023","352","36","Pattern Name: Processor","B08LKJPR5X"
"United States",,"2023-02-16",,"fourStar","true","6",,,"B08LKJPR5X","4","https://www.amazon.in/product-reviews/B08LKJPR5X?pageNumber=2&filterByStar=four_star&sortBy=helpful&formatType=all_formats&language=en","Thought it was supposed to be new but the seal was half off. Inside the thermal paste was clean so it hasn't been installed","R1T5KN5EIL5TDN",,,,"One person found this helpful","Says new but unsure",,"Reviewed in the United States on 16 February 2023","352","36","Pattern Name: Processor","B08LKJPR5X"
"United States",,"2022-06-07",,"fourStar","true","7",,,"B08LKJPR5X","4","https://www.amazon.in/product-reviews/B08LKJPR5X?pageNumber=2&filterByStar=four_star&sortBy=helpful&formatType=all_formats&language=en","El procesador ha funcionado a la perfección, sin embargo venía la cinta de seguridad abierta. Aún así, revisé la pasta térmica que trae pre aplicada el cooler y estaba bien, así que dudo que haya sido usado antes. Repito, aún así el procesador ha funcionado a la perfección, sólo esa pequeña observación.","R27UCS7J25OOMK",,,,"One person found this helpful","Caja abierta",,"Reviewed in the United States on 7 June 2022","352","36","Pattern Name: Processor","B08LKJPR5X"
"Mexico",,"2021-06-16",,"fourStar","true","8",,,"B08LKJPR5X","4","https://www.amazon.in/product-reviews/B08LKJPR5X?pageNumber=2&filterByStar=four_star&sortBy=helpful&formatType=all_formats&language=en","Si pueden irse por un i5 y de 11va mucho mejor la verdad la diferencia es considerable y depende del lugar pero pueden encontrarlo a buen precio y pos $1500  tienen un procesador que jala con cualquier tarjeta gráfica de muy buena manera obvio no exageneremos con una 3090 y otra recomendación en motherboard que sea apartir de las b y no de las h o a en AMD las conexiones y calidad son mejores, también si le ponen motherboard de 11va les sale más caro pero igual pueden hacer más cosas con las Memorias RAM son 2 tips que van a apreciar conforme vayan queriendo hacerle más cosas a su PC","R41MUARMPILJ6",,,,"11 people found this helpful","Buen producto, pero...",,"Reviewed in Mexico on 16 June 2021","352","36","Pattern Name: Processor","B08LKJPR5X"
"United States",,"2021-11-02",,"fourStar","true","9",,,"B08LKJPR5X","4","https://www.amazon.in/product-reviews/B08LKJPR5X?pageNumber=2&filterByStar=four_star&sortBy=helpful&formatType=all_formats&language=en","Comes in a shipping bag, leading to the product box getting a little beat up. First time around, had to return due to tampered product but Amazon replaced it no problem. Second time got the correct product. Easy install, comes with heat synch and conducting gel. Gel already on synchronized, so be careful not to touch.Working great to computer gaming. Inexpensive chip for high performance.","R3HKXEAMP3TPYY",,,,"One person found this helpful","Great low priced cpu",,"Reviewed in the United States on 2 November 2021","352","36","Pattern Name: Processor","B08LKJPR5X"
"United States",,"2022-01-17",,"fourStar","true","10",,,"B08LKJPR5X","4","https://www.amazon.in/product-reviews/B08LKJPR5X?pageNumber=2&filterByStar=four_star&sortBy=helpful&formatType=all_formats&language=en","For the price of just under 100$, u get a processor that is very good for mediocre gaming, run most games on ultra w no problems(obv depends on the gfx card, but still shows competence with the newer models even in 2022). Very easy to install even for beginners.","R38DBI7XRV4YX",,,,"One person found this helpful","Very good",,"Reviewed in the United States on 17 January 2022","352","36","Pattern Name: Processor","B08LKJPR5X"
"Japan",,"2021-05-11",,"fiveStar","true","1",,,"B08LKJPR5X","5","https://www.amazon.in/product-reviews/B08LKJPR5X?pageNumber=6&filterByStar=five_star&sortBy=helpful&formatType=all_formats&language=en","Intel 第11世代CPUのLGA1200 Core i3 10100Fです。「F」とつくモデルは内蔵グラフィック機能が廃止されておりグラフィックボードがないと映像を出力できないので注意が必要です。その代わり「無印」のモデルより価格が少し安くなっています。ただ注意点として画面が映らなくなってしまうような不具合が起きた時に内蔵出力が無い事によって不具合の原因究明が難しくなるデメリットがあります。そのため故障した時の事も考える場合は「無印」、とにかく値段の安さを取るなら「F」付きがオススメです。この値段の安さでなんと第7世代 Core i7 7700と同等の性能を持っています。当時35000円ほどしていたCore i7 7700がたった3年で10000円のCPUと同等の性能になってしまうので、第10世代の進化は素晴らしいです。超ハイスペックを目指さない限りはこのCPUで余裕です。","R26YDTX5AF2DDF",,,,"11 people found this helpful","Core i7 7700と同等の性能、グラフィック出力なし",,"Reviewed in Japan on 11 May 2021","2144","192","Pattern Name: Processor","B08LKJPR5X"
"Mexico",,"2023-06-11",,"fiveStar","true","2",,,"B08LKJPR5X","5","https://www.amazon.in/product-reviews/B08LKJPR5X?pageNumber=6&filterByStar=five_star&sortBy=helpful&formatType=all_formats&language=en","Anteriormente tenia un i3 de séptima generación siempre estaba arriba de los 50°, pero este siendo más nuevo se mantiene en los 37-45°, usando el mismo disipador un cool master de aire","R2FCNLNRDDSR6A",,,,"","Buen desempeño",,"Reviewed in Mexico on 11 June 2023","2144","192","Pattern Name: Processor","B08LKJPR5X"
"United Kingdom",,"2023-02-24",,"fiveStar","true","3",,,"B08LKJPR5X","5","https://www.amazon.in/product-reviews/B08LKJPR5X?pageNumber=6&filterByStar=five_star&sortBy=helpful&formatType=all_formats&language=en","All perfect.","R1XEL0IK7MST6H",,,,"3 people found this helpful","Tip Top",,"Reviewed in the United Kingdom on 24 February 2023","2144","192","Pattern Name: Processor","B08LKJPR5X"
"Canada",,"2023-07-31",,"fiveStar","true","4",,,"B08LKJPR5X","5","https://www.amazon.in/product-reviews/B08LKJPR5X?pageNumber=6&filterByStar=five_star&sortBy=helpful&formatType=all_formats&language=en","Already reviewed this processor","R1Q2JOR7KYTIAF",,,,"","Working great",,"Reviewed in Canada on 31 July 2023","2144","192","Pattern Name: Processor","B08LKJPR5X"
"United States",,"2023-03-27",,"fiveStar","true","5",,,"B08LKJPR5X","5","https://www.amazon.in/product-reviews/B08LKJPR5X?pageNumber=6&filterByStar=five_star&sortBy=helpful&formatType=all_formats&language=en","I build my own computers. I needed to upgrade to something that was Windows 11 compatible. I chose this CPU because of budgetary reasons. I have not been disappointed. While I am not a gamer, this CPU was easy to install and has done a great job with my computing needs (emails, videos, etc.). If you have limited resources, and need a good CPU for basic home use, this one is worth your consideration.","R357SE1Q09F2FW",,,,"","Budget CPU",,"Reviewed in the United States on 27 March 2023","2144","192","Pattern Name: Processor","B08LKJPR5X"
"United Kingdom",,"2021-01-09",,"fiveStar","true","6",,,"B08LKJPR5X","5","https://www.amazon.in/product-reviews/B08LKJPR5X?pageNumber=6&filterByStar=five_star&sortBy=helpful&formatType=all_formats&language=en","Very affordable for the price, you get 4 cores 8 threads, not overclockable but it does adjust the mhz depending on the amount of usage it needs","R2Y6XV8Q1156JI",,,,"34 people found this helpful","One of the most affordable CPUs as of 08/04/2022",,"Reviewed in the United Kingdom on 9 January 2021","2144","192","Pattern Name: Processor","B08LKJPR5X"
"Canada",,"2022-04-15",,"fiveStar","true","7",,,"B08LKJPR5X","5","https://www.amazon.in/product-reviews/B08LKJPR5X?pageNumber=6&filterByStar=five_star&sortBy=helpful&formatType=all_formats&language=en","Bought this along with an Asus Prime board to upgrade my mother’s computer (an old Core2Quad that still works quite well with Windows 10). It started up right away without issues. Will eventually update to Windows 11, which was the reason for the switch. She only needs it for Internet, not for gaming, so I can’t attest to its abilities there. The system has 16 GB of RAM and a Radeon RX 550 video, so it runs more than fast enough for her purposes. A+++","R12FIVFN1OJR3R",,,,"One person found this helpful","Good processor, great price",,"Reviewed in Canada on 15 April 2022","2144","192","Pattern Name: Processor","B08LKJPR5X"
"Mexico",,"2022-07-29",,"fiveStar","true","8",,,"B08LKJPR5X","5","https://www.amazon.in/product-reviews/B08LKJPR5X?pageNumber=6&filterByStar=five_star&sortBy=helpful&formatType=all_formats&language=en","Muy buen producto por el precio que tiene, es muy bueno por si quieres armar una Pc para juegos y no tienes mucho presupuesto.","R1IHOB3MGM959C",,,,"One person found this helpful","Buen producto",,"Reviewed in Mexico on 29 July 2022","2144","192","Pattern Name: Processor","B08LKJPR5X"
"Japan",,"2021-10-23",,"fiveStar","true","9",,,"B08LKJPR5X","5","https://www.amazon.in/product-reviews/B08LKJPR5X?pageNumber=6&filterByStar=five_star&sortBy=helpful&formatType=all_formats&language=en","安定感。cpuに求められる一番の要求。","RVUAPBAT5IAKQ",,,,"One person found this helpful","矢張りintel。安定感あり。",,"Reviewed in Japan on 23 October 2021","2144","192","Pattern Name: Processor","B08LKJPR5X"
"United States",,"2023-04-20",,"fiveStar","true","10",,,"B08LKJPR5X","5","https://www.amazon.in/product-reviews/B08LKJPR5X?pageNumber=6&filterByStar=five_star&sortBy=helpful&formatType=all_formats&language=en","First of all, this CPU does not have integrated graphics, so you need a graphics card.  But for me it's perfect, because it works much better.  So if you want to build a pc for work at home or you are a regular gamer.  This Core i3 is not expensive and with good performance, I think this cpu is what you need... I recommend it.","R1OKEGU8DXWEDX",,,,"One person found this helpful","Highly recommended..!!",,"Reviewed in the United States on 20 April 2023","2144","192","Pattern Name: Processor","B08LKJPR5X"
"Canada",,"2022-08-30",,"fiveStar","true","1",,,"B08LKJPR5X","5","https://www.amazon.in/product-reviews/B08LKJPR5X?pageNumber=5&filterByStar=five_star&sortBy=helpful&formatType=all_formats&language=en","This processor is a great budget-friendly processor for gamers that want to create their own custom PCs.I bought this processor back in November 2021 and it arrived a week from ordering it. The packaging was solid (I believed that the processor's box would be well cushioned if dropped accidentally). Although, the box of the processor was a little scuffed; as if it was overly used. This concerned me until I tested the processor along with its heat-sink fan. I used this processor for University, programming, and gaming.Like I said, the processor comes with a fan and pre-applied thermal paste with it. Overall, this is an authentic Intel processor and would recommend to my friends in case they want to start with a budget-friendly PC component.","R14MS1EXK0W6TW",,,,"One person found this helpful","Budget-Friendly Intel Processor",,"Reviewed in Canada on 30 August 2022","2144","192","Pattern Name: Processor","B08LKJPR5X"
