"country","countryCode","date","filterByKeyword","filterByRating","isVerified","position","product/listPrice","product/price","productAsin","ratingScore","reviewCategoryUrl","reviewDescription","reviewId","reviewImages/0","reviewImages/1","reviewImages/2","reviewReaction","reviewTitle","reviewUrl","reviewedIn","totalCategoryRatings","totalCategoryReviews","variant","variantAsin"
"Brazil",,"2022-05-28",,"fiveStar","true","2",,,"B08LKJPR5X","5","https://www.amazon.in/product-reviews/B08LKJPR5X?pageNumber=5&filterByStar=five_star&sortBy=helpful&formatType=all_formats&language=en","Processador extremamente custo benefício,roda quase tudo na qualidade alta","R1DKXGRXXYE3NP",,,,"One person found this helpful","Ótimo produto",,"Reviewed in Brazil on 28 May 2022","2144","192","Pattern Name: Processor","B08LKJPR5X"
"United States",,"2022-08-06",,"fiveStar","true","3",,,"B08LKJPR5X","5","https://www.amazon.in/product-reviews/B08LKJPR5X?pageNumber=5&filterByStar=five_star&sortBy=helpful&formatType=all_formats&language=en","This offer allowed me to build a super low budget PC which beats the i7-4770 it replaced in every single aspect. More performance, less power draw, less noise, better thermals. Don't buy an old used i7-4770 which will still go for $50 or more when you can buy this CPU new with fresh thermal paste and CPU cooler already included.The only issue you might face is finding a good offer for a motherboard but if you manage to do so you'll be ready for future upgrades. Mind you, you will need a dedicated graphics card or you might want to look for the non-""f"" version.My order was shipped very fast and arrived in an original sealed box in immaculate condition which makes me a happy customer.","R2DMK0L78K9UH6",,,,"10 people found this helpful","Great value - only one downside",,"Reviewed in the United States on 6 August 2022","2144","192","Pattern Name: Processor","B08LKJPR5X"
"Japan",,"2023-11-07",,"fiveStar","true","4",,,"B08LKJPR5X","5","https://www.amazon.in/product-reviews/B08LKJPR5X?pageNumber=5&filterByStar=five_star&sortBy=helpful&formatType=all_formats&language=en","でも今の画像処理程度の作業では特段の問題なく使えています。","R3F6DORJEGSA32",,,,"","ちょっと力不足？",,"Reviewed in Japan on 7 November 2023","2144","192","Pattern Name: Processor","B08LKJPR5X"
"United Kingdom",,"2023-02-19",,"fiveStar","true","5",,,"B08LKJPR5X","5","https://www.amazon.in/product-reviews/B08LKJPR5X?pageNumber=5&filterByStar=five_star&sortBy=helpful&formatType=all_formats&language=en","Popular CPU choice for my clients when it comes to budget builds. Highly recommended.","R14YZX5IT745SZ",,,,"2 people found this helpful","Great CPU for daily computing",,"Reviewed in the United Kingdom on 19 February 2023","2144","192","Pattern Name: Processor","B08LKJPR5X"
"Japan",,"2023-09-23",,"fiveStar","true","6",,,"B08LKJPR5X","5","https://www.amazon.in/product-reviews/B08LKJPR5X?pageNumber=5&filterByStar=five_star&sortBy=helpful&formatType=all_formats&language=en","シネベンチでも余裕の性能です。","RHMEGM5M173WH",,,,"2 people found this helpful","4コア8スレッドは流石です",,"Reviewed in Japan on 23 September 2023","2144","192","Pattern Name: Processor","B08LKJPR5X"
"Mexico",,"2022-10-15",,"fiveStar","true","7",,,"B08LKJPR5X","5","https://www.amazon.in/product-reviews/B08LKJPR5X?pageNumber=5&filterByStar=five_star&sortBy=helpful&formatType=all_formats&language=en","La relación de calidad y precio es inmejorable. Para una PC de trabajo o Gamer de entrada sirve perfectamente. Gracias a que consume muy poca energía solo necesita una fuente desde 400w. Muy recomendable si no quieres gastar demasiado en una PC…","R32ZLL9VEGK3DA",,,,"One person found this helpful","Excelente",,"Reviewed in Mexico on 15 October 2022","2144","192","Pattern Name: Processor","B08LKJPR5X"
"United States",,"2024-04-18",,"fiveStar","true","8",,,"B08LKJPR5X","5","https://www.amazon.in/product-reviews/B08LKJPR5X?pageNumber=5&filterByStar=five_star&sortBy=helpful&formatType=all_formats&language=en","Value","R29IGE6CWB6SB1",,,,"","i3-10100f",,"Reviewed in the United States on 18 April 2024","2144","192","Pattern Name: Processor","B08LKJPR5X"
"Canada",,"2022-11-13",,"fiveStar","true","9",,,"B08LKJPR5X","5","https://www.amazon.in/product-reviews/B08LKJPR5X?pageNumber=5&filterByStar=five_star&sortBy=helpful&formatType=all_formats&language=en","My previous processors were i7 3700 and i5 4590k and for me this is a major improvement in terms of performance. My RX 580 runs with almost no bottleneck with this processor unlike the other 2. Would definitely recommend it because of the price but if you have a little more money i would recommend going with the i3 12100f or the i5 10400f.","R25RHLYNN0Y8U",,,,"","Excellent Processor for the price, fast shipping, would recommend this item",,"Reviewed in Canada on 13 November 2022","2144","192","Pattern Name: Processor","B08LKJPR5X"
"United Kingdom",,"2022-01-24",,"fiveStar","true","10",,,"B08LKJPR5X","5","https://www.amazon.in/product-reviews/B08LKJPR5X?pageNumber=5&filterByStar=five_star&sortBy=helpful&formatType=all_formats&language=en","Decent cpu if you are on a budget. Was fine with this. Newer versions even better.","R1LYW1D7DTUBPL",,,,"29 people found this helpful","Great budget cpu",,"Reviewed in the United Kingdom on 24 January 2022","2144","192","Pattern Name: Processor","B08LKJPR5X"
"Japan",,"2021-11-21",,"oneStar","true","1",,,"B08LKJPR5X","1","https://www.amazon.in/product-reviews/B08LKJPR5X?pageNumber=3&filterByStar=one_star&sortBy=helpful&formatType=all_formats&language=en","Fanの品質が悪くて、エラーになってます、","R1K8I2GC4LNBLJ",,,,"One person found this helpful","品質悪い",,"Reviewed in Japan on 21 November 2021","101","29","Pattern Name: Processor","B08LKJPR5X"
"United States",,"2021-07-20",,"oneStar","true","2",,,"B08LKJPR5X","1","https://www.amazon.in/product-reviews/B08LKJPR5X?pageNumber=3&filterByStar=one_star&sortBy=helpful&formatType=all_formats&language=en","No lo llegue a probar porque nunca me llegó el paquete a mi casa, pero he visto videos que es un buen procesador","R3552P7UZ8DXDD",,,,"One person found this helpful","No se que poner swui",,"Reviewed in the United States on 20 July 2021","101","29","Pattern Name: Processor","B08LKJPR5X"
"United States",,"2021-07-21",,"oneStar","true","3",,,"B08LKJPR5X","1","https://www.amazon.in/product-reviews/B08LKJPR5X?pageNumber=3&filterByStar=one_star&sortBy=helpful&formatType=all_formats&language=en","I bought it for less than a month and it went down, really? Not on schedule, really want to return","R1I7AXBFSMKGDL",,,,"","It's been less than a month since the price was cut, really?",,"Reviewed in the United States on 21 July 2021","101","29","Pattern Name: Processor","B08LKJPR5X"
"United States",,"2021-09-21",,"oneStar","true","4",,,"B08LKJPR5X","1","https://www.amazon.in/product-reviews/B08LKJPR5X?pageNumber=3&filterByStar=one_star&sortBy=helpful&formatType=all_formats&language=en","The Box is open , so its not all new , and Damage on side","R2CUZMW42LPEFZ",,,,"","Opened Box and Damage",,"Reviewed in the United States on 21 September 2021","101","29","Pattern Name: Processor","B08LKJPR5X"
"United States",,"2022-09-21",,"oneStar","true","5",,,"B08LKJPR5X","1","https://www.amazon.in/product-reviews/B08LKJPR5X?pageNumber=3&filterByStar=one_star&sortBy=helpful&formatType=all_formats&language=en","the box was all mushed and the i3-10100f was broken","R1A31WQYGTQZBB",,,,"","It was broken",,"Reviewed in the United States on 21 September 2022","101","29","Pattern Name: Processor","B08LKJPR5X"
"United States",,"2021-09-11",,"oneStar","true","6",,,"B08LKJPR5X","1","https://www.amazon.in/product-reviews/B08LKJPR5X?pageNumber=3&filterByStar=one_star&sortBy=helpful&formatType=all_formats&language=en","When installed the motherboard emits 5 short beeps which means cpu error.","R2IWQ1RC2KVENC",,,,"One person found this helpful","The cpu doesn't work",,"Reviewed in the United States on 11 September 2021","101","29","Pattern Name: Processor","B08LKJPR5X"
"United States",,"2021-08-11",,"oneStar","true","7",,,"B08LKJPR5X","1","https://www.amazon.in/product-reviews/B08LKJPR5X?pageNumber=3&filterByStar=one_star&sortBy=helpful&formatType=all_formats&language=en","Over all the i3 is a good cpu but the package was very damaged","R35NL2XL6H9I6J",,,,"","The package came very damaged should have asked for a refund but was too late",,"Reviewed in the United States on 11 August 2021","101","29","Pattern Name: Processor","B08LKJPR5X"
"United States",,"2022-04-02",,"oneStar","true","8",,,"B08LKJPR5X","1","https://www.amazon.in/product-reviews/B08LKJPR5X?pageNumber=3&filterByStar=one_star&sortBy=helpful&formatType=all_formats&language=en","Cpu cooler was completly broken","R3C87EW64QC5J3",,,,"One person found this helpful","Bad cooler",,"Reviewed in the United States on 2 April 2022","101","29","Pattern Name: Processor","B08LKJPR5X"
"United States",,"2022-01-09",,"oneStar","true","9",,,"B08LKJPR5X","1","https://www.amazon.in/product-reviews/B08LKJPR5X?pageNumber=3&filterByStar=one_star&sortBy=helpful&formatType=all_formats&language=en","Cam I bent","R2TK07D2AQ5XH4",,,,"","Came in damaged",,"Reviewed in the United States on 9 January 2022","101","29","Pattern Name: Processor","B08LKJPR5X"
"United States",,"2021-11-28",,"fiveStar","true","1",,,"B08LKJPR5X","5","https://www.amazon.in/product-reviews/B08LKJPR5X?pageNumber=8&filterByStar=five_star&sortBy=helpful&formatType=all_formats&language=en","Excelente, precio rendimiento para iniciar en el mundo gaming, muy económico, se tardo un poco en llegar a Colombia no se si por motivos de aduanas o que pero llego en perfecto estado, la caja si llego un poco golpeada en las esquinas pero nada grave todo funcional, 100% recomendado para que empieces en el mundo gaming sin problemas.","R2694GULQCRYXQ",,,,"2 people found this helpful","Excelente precio, rendimiento para entrar al mundo gaming.",,"Reviewed in the United States on 28 November 2021","2144","192","Pattern Name: Processor","B08LKJPR5X"
"United States",,"2022-12-25",,"fiveStar","true","2",,,"B08LKJPR5X","5","https://www.amazon.in/product-reviews/B08LKJPR5X?pageNumber=8&filterByStar=five_star&sortBy=helpful&formatType=all_formats&language=en","This CPU is very good for light gaming, and daily use. you can play more intensive games using this though it will be a lot more taxing on your system. I haven’t tried over clocking yet (if possible).","R140AVCXCX4QJB",,,,"","good for light gaming and daily use",,"Reviewed in the United States on 25 December 2022","2144","192","Pattern Name: Processor","B08LKJPR5X"
"United States",,"2023-07-18",,"fiveStar","true","3",,,"B08LKJPR5X","5","https://www.amazon.in/product-reviews/B08LKJPR5X?pageNumber=8&filterByStar=five_star&sortBy=helpful&formatType=all_formats&language=en","buen producto","R2VKAGYGOOOHF9",,,,"","good produc",,"Reviewed in the United States on 18 July 2023","2144","192","Pattern Name: Processor","B08LKJPR5X"
"United States",,"2021-02-21",,"fiveStar","true","4",,,"B08LKJPR5X","5","https://www.amazon.in/product-reviews/B08LKJPR5X?pageNumber=8&filterByStar=five_star&sortBy=helpful&formatType=all_formats&language=en","I got this for my first ""actual"" pc build, and to be quite honest with you, the i3 line of processors have gotten a lot better over the years. Previous to this, I was rocking an i5 2500, and this has made a whole heap of a difference. I run virtual machines, and play AAA games, paired with a gtx 1650 gddr6 edition, I have no issue. I for a mass majority of the time I get over 60 fps on almost any game I play at medium to high settings...","R29XLS2KGG95W6",,,,"19 people found this helpful","Great Processor",,"Reviewed in the United States on 21 February 2021","2144","192","Pattern Name: Processor","B08LKJPR5X"
"United States",,"2021-10-18",,"fiveStar","true","5",,,"B08LKJPR5X","5","https://www.amazon.in/product-reviews/B08LKJPR5X?pageNumber=8&filterByStar=five_star&sortBy=helpful&formatType=all_formats&language=en","Paired this with my GTX 1060 6GB, and I'm getting those smooth frames I was missing before. I had been using the same i5 3670k for about 8 years, it was adequate but aging. This i3 10100f does the trick. Stays cool with stock cooler as well. Been playing and bench marking Red Dead Redemption 2, War Thunder, AC Origins, etc and its staying under 70C. Very pleased.","R3H7QPDTAMS3Z8",,,,"2 people found this helpful","Great CPU",,"Reviewed in the United States on 18 October 2021","2144","192","Pattern Name: Processor","B08LKJPR5X"
"United States",,"2022-12-03",,"fiveStar","true","6",,,"B08LKJPR5X","5","https://www.amazon.in/product-reviews/B08LKJPR5X?pageNumber=8&filterByStar=five_star&sortBy=helpful&formatType=all_formats&language=en","Lo he instalado en el equipo de un cliente, funcionó perfectamente, entendemos de que es un procesador sin gráficos integrados pero que va exactamente igual que su modelo sin F, no defraudó, buena compra.","R2M24DE4CLYMQW",,,,"","Excelente opción, sin problema, ideal para entrada",,"Reviewed in the United States on 3 December 2022","2144","192","Pattern Name: Processor","B08LKJPR5X"
"United States",,"2021-08-26",,"fiveStar","true","7",,,"B08LKJPR5X","5","https://www.amazon.in/product-reviews/B08LKJPR5X?pageNumber=8&filterByStar=five_star&sortBy=helpful&formatType=all_formats&language=en","Me encanto, compre con desconfianza desde Colombia, pero valió la pena tomar el riesgo, me llego a Bogotá en perfecto estado y antes de lo esperado.  Lo instale hace una semana y fue una mejora evidente frente a mi viejo procesador. Ahora lo corro en una board MAG B560 Torpedo, Corsair Vengeance LPX 16 GB (2 x 8 GB) DDR4 3600 y una tarjeta de video gtx 1050Ti msi.","R1CDMXN01LEJM2",,,,"2 people found this helpful","Producto 100% recomendado",,"Reviewed in the United States on 26 August 2021","2144","192","Pattern Name: Processor","B08LKJPR5X"
"Canada",,"2022-12-30",,"fiveStar","true","8",,,"B08LKJPR5X","5","https://www.amazon.in/product-reviews/B08LKJPR5X?pageNumber=8&filterByStar=five_star&sortBy=helpful&formatType=all_formats&language=en","insane but memory capped at 2666mhz","R2MQD7A2SB40MH",,,,"","Memory capped at 2666mhz, dual channel",,"Reviewed in Canada on 30 December 2022","2144","192","Pattern Name: Processor","B08LKJPR5X"
"Canada",,"2022-04-13",,"fiveStar","true","9",,,"B08LKJPR5X","5","https://www.amazon.in/product-reviews/B08LKJPR5X?pageNumber=8&filterByStar=five_star&sortBy=helpful&formatType=all_formats&language=en","all cpu with a F on the end as no graphic processor wath it mean you need a adon gpu aka graphic card for it to work very happy work fine nice","R3B6U1T3UD8RPT",,,,"","Intel CPU BX8070110100F Core i3-10100F",,"Reviewed in Canada on 13 April 2022","2144","192","Pattern Name: Processor","B08LKJPR5X"
"United States",,"2022-10-10",,"fiveStar","true","10",,,"B08LKJPR5X","5","https://www.amazon.in/product-reviews/B08LKJPR5X?pageNumber=8&filterByStar=five_star&sortBy=helpful&formatType=all_formats&language=en","This i3 is very comparable to a i7 3770 but with the added bonus of being able to support the newer gen standards. Great for gaming and daily compute tasks.","RQKU43WP180A3",,,,"2 people found this helpful","I3 with older i7 performance",,"Reviewed in the United States on 10 October 2022","2144","192","Pattern Name: Processor","B08LKJPR5X"
"Mexico",,"2023-02-09",,"fiveStar","true","1",,,"B08LKJPR5X","5","https://www.amazon.in/product-reviews/B08LKJPR5X?pageNumber=4&filterByStar=five_star&sortBy=helpful&formatType=all_formats&language=en","Neceaitaba un CPU para oficina, estaba muy barato este micro y pues aproveche, lo unico malo es que no tiene grafica integrada, encontre una de seguna mano y pues esta funcionando muy bien","RMBAW8D97SNPI",,,,"","Buen rendimiento a un buen precio",,"Reviewed in Mexico on 9 February 2023","2144","192","Pattern Name: Processor","B08LKJPR5X"
"Spain",,"2022-01-29",,"fiveStar","true","2",,,"B08LKJPR5X","5","https://www.amazon.in/product-reviews/B08LKJPR5X?pageNumber=4&filterByStar=five_star&sortBy=helpful&formatType=all_formats&language=en","Por su bajo precio la calidad obtenidad es muy buena... Totalmente recomendado. Tomen en cuenta que este procesador no trae Video Incorporado","R3PC06S84EOL1P",,,,"One person found this helpful","Calida y Precio",,"Reviewed in Spain on 29 January 2022","2144","192","Pattern Name: Processor","B08LKJPR5X"
"United States",,"2024-02-10",,"fiveStar","true","3",,,"B08LKJPR5X","5","https://www.amazon.in/product-reviews/B08LKJPR5X?pageNumber=4&filterByStar=five_star&sortBy=helpful&formatType=all_formats&language=en","Came in the perfect little box, where it didn’t slide around packaging was perfect. Really good price. I got it $75 off from one that is brand new. Works really well 10/10 would recommend","RFA8G1IJ6K8U",,,,"One person found this helpful","Perfect packaging, Really good deal, and works as intended",,"Reviewed in the United States on 10 February 2024","2144","192","Pattern Name: Processor","B08LKJPR5X"
"United Kingdom",,"2023-01-06",,"fiveStar","true","4",,,"B08LKJPR5X","5","https://www.amazon.in/product-reviews/B08LKJPR5X?pageNumber=4&filterByStar=five_star&sortBy=helpful&formatType=all_formats&language=en","Perfect for what I need","R2RQ6K73OHBTED",,,,"2 people found this helpful","Great budget cpu",,"Reviewed in the United Kingdom on 6 January 2023","2144","192","Pattern Name: Processor","B08LKJPR5X"
"United States",,"2024-06-24",,"fiveStar","true","5",,,"B08LKJPR5X","5","https://www.amazon.in/product-reviews/B08LKJPR5X?pageNumber=4&filterByStar=five_star&sortBy=helpful&formatType=all_formats&language=en","Good for gaming","R2YJKMCK4OLW8Z",,,,"","Good CPU",,"Reviewed in the United States on 24 June 2024","2144","192","Pattern Name: Processor","B08LKJPR5X"
"Brazil",,"2022-07-14",,"fiveStar","true","6",,,"B08LKJPR5X","5","https://www.amazon.in/product-reviews/B08LKJPR5X?pageNumber=4&filterByStar=five_star&sortBy=helpful&formatType=all_formats&language=en","Produto muito bom","R1W7W49MBFQ3GC",,,,"","Produto bom",,"Reviewed in Brazil on 14 July 2022","2144","192","Pattern Name: Processor","B08LKJPR5X"
"Mexico",,"2023-04-23",,"fiveStar","true","7",,,"B08LKJPR5X","5","https://www.amazon.in/product-reviews/B08LKJPR5X?pageNumber=4&filterByStar=five_star&sortBy=helpful&formatType=all_formats&language=en","Excelente, la potencia la uso mas para ofimatica y algo de gaming como Cyberpunk 2077 y nada mal","RXZ8QB7AK4DUZ",,,,"One person found this helpful","El procesador mas decente por su precio",,"Reviewed in Mexico on 23 April 2023","2144","192","Pattern Name: Processor","B08LKJPR5X"
"Australia",,"2021-08-30",,"fiveStar","true","8",,,"B08LKJPR5X","5","https://www.amazon.in/product-reviews/B08LKJPR5X?pageNumber=4&filterByStar=five_star&sortBy=helpful&formatType=all_formats&language=en","Cheapest CPU you can buy at the moment. Pretty laggy but gets the job done. Haven't extensively tested.","R11B62W7M1IZD0",,,,"","Good little CPU",,"Reviewed in Australia on 30 August 2021","2144","192","Pattern Name: Processor","B08LKJPR5X"
"Canada",,"2023-01-19",,"fiveStar","true","9",,,"B08LKJPR5X","5","https://www.amazon.in/product-reviews/B08LKJPR5X?pageNumber=4&filterByStar=five_star&sortBy=helpful&formatType=all_formats&language=en","Used this for a cheap upgrade for the family PC which sees light gaming, web browsing and school use (MS office).Pros:1) Price/value;2) low 65w TDP meant I didn't have to upgrade the power supply;3) Decent desk top performance;Cons:1) Only 4 Cores (still adequate for normal desk top use);2) The 10100f doesn't have built-in graphics.Note: The requirement for a discrete graphics card isn't really a con, as any cheap/used graphics card will be better than the Intel graphics on the normal i3 10100. Just be aware of this requirement before purchasing.","R1DD9CZS5MVNN",,,,"2 people found this helpful","Good Budget CPU for desktop use and some entry level gaming",,"Reviewed in Canada on 19 January 2023","2144","192","Pattern Name: Processor","B08LKJPR5X"
"Mexico",,"2021-12-04",,"fiveStar","true","10",,,"B08LKJPR5X","5","https://www.amazon.in/product-reviews/B08LKJPR5X?pageNumber=4&filterByStar=five_star&sortBy=helpful&formatType=all_formats&language=en","Para trabajo de oficina, escuela o profesional es excelente, barato, bajo consumo de energía, muy rápido y silencioso, para juegos AAA en calidad ultra tiene cuello de botella, lo probé con 3080ti y hay mucha diferencia en fluidez con un i5 de 10 u 11° generación","R2HGPFPL1HN6PE",,,,"2 people found this helpful","Mejor procesador para trabajo",,"Reviewed in Mexico on 4 December 2021","2144","192","Pattern Name: Processor","B08LKJPR5X"
"Brazil",,"2022-02-09",,"oneStar","true","1",,,"B08LKJPR5X","1","https://www.amazon.in/product-reviews/B08LKJPR5X?pageNumber=2&filterByStar=one_star&sortBy=helpful&formatType=all_formats&language=en","Item com defeito . E o vendedor não quis reembolsar o valor íntegral.Pra jogo e bom .","RESBVNXNKLUAR",,,,"5 people found this helpful","Horrível",,"Reviewed in Brazil on 9 February 2022","101","29","Pattern Name: Processor","B08LKJPR5X"
"United Kingdom",,"2024-05-17",,"oneStar","true","2",,,"B08LKJPR5X","1","https://www.amazon.in/product-reviews/B08LKJPR5X?pageNumber=2&filterByStar=one_star&sortBy=helpful&formatType=all_formats&language=en","Didn't fit when it said it did not good","R2182KE0YH2B0U",,,,"","It didn't fit my computer when it said it would",,"Reviewed in the United Kingdom on 17 May 2024","101","29","Pattern Name: Processor","B08LKJPR5X"
"Canada",,"2023-06-16",,"oneStar","true","3",,,"B08LKJPR5X","1","https://www.amazon.in/product-reviews/B08LKJPR5X?pageNumber=2&filterByStar=one_star&sortBy=helpful&formatType=all_formats&language=en","Intel what are you even thinking with those plastic pins? They break easily and will get stuck in the motherboard forcing you to break the pins to get the thing off the motherboard. Use metal screws or don't bother bundling a heat sink. Absolutely ridiculous.","R1G7NWZH2YR8U4",,,,"","The plastic pins on the heatsink are worthless",,"Reviewed in Canada on 16 June 2023","101","29","Pattern Name: Processor","B08LKJPR5X"
"United States",,"2022-08-14",,"oneStar","true","4",,,"B08LKJPR5X","1","https://www.amazon.in/product-reviews/B08LKJPR5X?pageNumber=2&filterByStar=one_star&sortBy=helpful&formatType=all_formats&language=en","I bought used and the box was retaped with no damage so It didn't fall out of the box! There was enough weight from the heatsink that when I opened it I was looking around like where is it? Not happy about this purchase and I want a refund!","RK53PVK769OQZ",,,,"","There was no CPU in the box only the Heatsink with fan",,"Reviewed in the United States on 14 August 2022","101","29","Pattern Name: Processor","B08LKJPR5X"
"Canada",,"2022-01-19",,"oneStar","true","5",,,"B08LKJPR5X","1","https://www.amazon.in/product-reviews/B08LKJPR5X?pageNumber=2&filterByStar=one_star&sortBy=helpful&formatType=all_formats&language=en","recu une boite vide , juste le fan etait dans la boite et utilisé !","RJGECRB9WQ1K1",,,,"One person found this helpful","recu une boite vide !",,"Reviewed in Canada on 19 January 2022","101","29","Pattern Name: Processor","B08LKJPR5X"
"United States",,"2022-04-24",,"oneStar","true","6",,,"B08LKJPR5X","1","https://www.amazon.in/product-reviews/B08LKJPR5X?pageNumber=2&filterByStar=one_star&sortBy=helpful&formatType=all_formats&language=en","If you order a new one and it has a sticker with “LPN” this means that it has been returned. I ordered a new one but was clearly used you could still see thermal paste on the cpu. Returned it immediately.","RDRYYR2HXSXCA",,,,"2 people found this helpful","Watch for this",,"Reviewed in the United States on 24 April 2022","101","29","Pattern Name: Processor","B08LKJPR5X"
"United Kingdom",,"2021-12-11",,"oneStar","true","7",,,"B08LKJPR5X","1","https://www.amazon.in/product-reviews/B08LKJPR5X?pageNumber=2&filterByStar=one_star&sortBy=helpful&formatType=all_formats&language=en","Installed and didn't work. Took it to be checked out and told it was a dud","R1ME6P7BW4LES1",,,,"28 people found this helpful","Arrived faulty",,"Reviewed in the United Kingdom on 11 December 2021","101","29","Pattern Name: Processor","B08LKJPR5X"
"United States",,"2022-08-05",,"oneStar","true","8",,,"B08LKJPR5X","1","https://www.amazon.in/product-reviews/B08LKJPR5X?pageNumber=2&filterByStar=one_star&sortBy=helpful&formatType=all_formats&language=en","en la imagen real se puede ver que se necesita tarjeta grafica, he perdido mi dinero ahora debo comprar una tarjeta grafica","R1JSSV5GW4CR7K",,,,"","la imagen del producto es editada",,"Reviewed in the United States on 5 August 2022","101","29","Pattern Name: Processor","B08LKJPR5X"
"Japan",,"2021-05-22",,"oneStar","true","9",,,"B08LKJPR5X","1","https://www.amazon.in/product-reviews/B08LKJPR5X?pageNumber=2&filterByStar=one_star&sortBy=helpful&formatType=all_formats&language=en","デュアルチャンネルで使用するため２枚差しで起動しましたが起動しない１枚できどうはしました手持ちのメモリー２０枚ほど使いましたがどれも１枚ならきどうちなみにマザーはアスロックＨ４７０　ＩＴＸ同じＣＰＵと交換したらあっさり起動　デュアルチャンネルでＯＫでしした　ちなみにi9でも起動なので返品しました","RXHEO72QREQM9",,,,"3 people found this helpful","初期不良品",,"Reviewed in Japan on 22 May 2021","101","29","Pattern Name: Processor","B08LKJPR5X"
