"country","countryCode","date","filterByKeyword","filterByRating","isVerified","position","product/listPrice","product/price","productAsin","ratingScore","reviewCategoryUrl","reviewDescription","reviewId","reviewImages/0","reviewImages/1","reviewImages/2","reviewReaction","reviewTitle","reviewUrl","reviewedIn","totalCategoryRatings","totalCategoryReviews","variant","variantAsin"
"India",,"2021-09-04",,"twoStar","true","4",,,"B08LKJPR5X","2","https://www.amazon.in/product-reviews/B08LKJPR5X?pageNumber=1&filterByStar=two_star&sortBy=helpful&formatType=all_formats&language=en","This motherboard will not work without external video card. No video on board.","R127EEGUW9JTPE",,,,"One person found this helpful","This motherboard will not work without external video card. No video on board.","https://www.amazon.in/gp/customer-reviews/R127EEGUW9JTPE/ref=cm_cr_arp_d_rvw_ttl?ie=UTF8&ASIN=B08LKJPR5X","Reviewed in India on 4 September 2021","22","8","Pattern Name: Processor","B08LKJPR5X"
"India",,"2022-04-04",,"twoStar","false","5",,,"B08LKJPR5X","2","https://www.amazon.in/product-reviews/B08LKJPR5X?pageNumber=1&filterByStar=two_star&sortBy=helpful&formatType=all_formats&language=en","very bad packing product and Not secure product. fan quality is very bad. Give you two star. This product very hight price  but not proper secure parking.","RQD8QYKQW44W8",,,,"6 people found this helpful","Bad packing product.","https://www.amazon.in/gp/customer-reviews/RQD8QYKQW44W8/ref=cm_cr_arp_d_rvw_ttl?ie=UTF8&ASIN=B08LKJPR5X","Reviewed in India on 4 April 2022","22","8","Pattern Name: Processor","B08LKJPR5X"
"United States",,"2022-12-23",,"twoStar","true","6",,,"B08LKJPR5X","2","https://www.amazon.in/product-reviews/B08LKJPR5X?pageNumber=1&filterByStar=two_star&sortBy=helpful&formatType=all_formats&language=en","Had this product in my PC for about 3 months with no issues, tho cpu light was on since the time I built it (it worked fine so I assumed it was a problem with the motherboard) CPU worked just okay for gaming (at 1440p didn't agree with this cpu, was at around 90% utilization in games, especially desting 2) but this thing was a temp cpu until I had the bread to upgrade so I couldn't really complain. This thing did show its weaknesses in productivity, where the cpu struggled with multiple programs open at once. All was well until two weeks ago, when the computer wouldn't turn on. Extremely fortunate to have a local micro center, so I went there and paid $40 for a diagnosis that the cpu was dead. Thanks Intel.","R1K06QOQXO4NLK",,,,"","Defective CPU",,"Reviewed in the United States on 23 December 2022","22","8","Pattern Name: Processor","B08LKJPR5X"
"United States",,"2021-02-09",,"twoStar","true","7",,,"B08LKJPR5X","2","https://www.amazon.in/product-reviews/B08LKJPR5X?pageNumber=1&filterByStar=two_star&sortBy=helpful&formatType=all_formats&language=en","In the lower left hand corner this box should read ""Discrete Graphics Required""This might be an oversight of the seller using the wrong box, OR a complete omission of needed hardware to boost sales.REGUARDLESS: YOU WILL NEED TO PURCHASE A VIDEO CARD TO GO WITH THIS CHIP!I now have gotten 4 of these that I had to purchase video cards to accompany them.","RN1DCTRT6X8G9",,,,"18 people found this helpful","Edited photo of box?",,"Reviewed in the United States on 9 February 2021","22","8","Pattern Name: Processor","B08LKJPR5X"
"United States",,"2023-02-03",,"twoStar","true","8",,,"B08LKJPR5X","2","https://www.amazon.in/product-reviews/B08LKJPR5X?pageNumber=1&filterByStar=two_star&sortBy=helpful&formatType=all_formats&language=en","Factory seal was broken.","R24FNR0BLO9WUG",,,,"","Bought new, got used.",,"Reviewed in the United States on 3 February 2023","22","8","Pattern Name: Processor","B08LKJPR5X"
"United Kingdom",,"2021-03-27",,"threeStar","true","1",,,"B08LKJPR5X","3","https://www.amazon.in/product-reviews/B08LKJPR5X?pageNumber=2&filterByStar=three_star&sortBy=helpful&formatType=all_formats&language=en","the cpu itself was great and easy to install but the pins on the fan came broken so i had to buy a new one separately which was annoying.","R3AMCHMZCCD5N7",,,,"30 people found this helpful","good but fan pins were broken",,"Reviewed in the United Kingdom on 27 March 2021","103","12","Pattern Name: Processor","B08LKJPR5X"
"United States",,"2020-12-29",,"threeStar","true","2",,,"B08LKJPR5X","3","https://www.amazon.in/product-reviews/B08LKJPR5X?pageNumber=2&filterByStar=three_star&sortBy=helpful&formatType=all_formats&language=en","Package looks like it's been through world war 3 hopefully everything is still functional","R26ZITOBSG5CYU",,,,"25 people found this helpful","Damaged box",,"Reviewed in the United States on 29 December 2020","103","12","Pattern Name: Processor","B08LKJPR5X"
"United States",,"2022-10-16",,"fiveStar","true","1",,,"B08LKJPR5X","5","https://www.amazon.in/product-reviews/B08LKJPR5X?pageNumber=10&filterByStar=five_star&sortBy=helpful&formatType=all_formats&language=en","never thought id see an i3 this good, have it paired with a 1060 6gb and have zero complaints","R2XDBZFFDRPLVX",,,,"2 people found this helpful","crazy for an i3",,"Reviewed in the United States on 16 October 2022","2144","192","Pattern Name: Processor","B08LKJPR5X"
"United States",,"2022-08-20",,"fiveStar","true","2",,,"B08LKJPR5X","5","https://www.amazon.in/product-reviews/B08LKJPR5X?pageNumber=10&filterByStar=five_star&sortBy=helpful&formatType=all_formats&language=en","the motherboard worked good for me, fast shipping, board looked brand new , came with i/o shield sata cables and antenna for wifi","R2Y9EL38C0GT6R",,,,"One person found this helpful","motherboard worked good for me",,"Reviewed in the United States on 20 August 2022","2144","192","Pattern Name: Processor","B08LKJPR5X"
"United States",,"2022-07-04",,"fiveStar","true","3",,,"B08LKJPR5X","5","https://www.amazon.in/product-reviews/B08LKJPR5X?pageNumber=10&filterByStar=five_star&sortBy=helpful&formatType=all_formats&language=en","Lo llevo usando mucho tiempo y la verdad que no he tenido problemas.. si acaso no les sale video porque necesariamente debe tener una tarjeta grafica.","R2SAKJFFXO02MW",,,,"One person found this helpful","Buen producto",,"Reviewed in the United States on 4 July 2022","2144","192","Pattern Name: Processor","B08LKJPR5X"
"United States",,"2022-05-29",,"fiveStar","true","4",,,"B08LKJPR5X","5","https://www.amazon.in/product-reviews/B08LKJPR5X?pageNumber=10&filterByStar=five_star&sortBy=helpful&formatType=all_formats&language=en","Es un buen producto para Ofimática, cosas de laCada. Ojo qué hay que colocar una tarjeta de video aparte, porque no trae video integrado en el procesador.","R377UZTKT925G2",,,,"One person found this helpful","Buen producto",,"Reviewed in the United States on 29 May 2022","2144","192","Pattern Name: Processor","B08LKJPR5X"
"United States",,"2022-05-29",,"fiveStar","true","5",,,"B08LKJPR5X","5","https://www.amazon.in/product-reviews/B08LKJPR5X?pageNumber=10&filterByStar=five_star&sortBy=helpful&formatType=all_formats&language=en","I paired this with a MSI Z490 and didn’t even need to update the Bios. Seems to be running great and was fairly easy for a novice builder.","R20VZ4AKUHQHP6",,,,"2 people found this helpful","Great Deal & easy Install",,"Reviewed in the United States on 29 May 2022","2144","192","Pattern Name: Processor","B08LKJPR5X"
"United States",,"2022-08-18",,"fiveStar","true","6",,,"B08LKJPR5X","5","https://www.amazon.in/product-reviews/B08LKJPR5X?pageNumber=10&filterByStar=five_star&sortBy=helpful&formatType=all_formats&language=en","This cpu is has great price/performance, even after the release of the 12100f, its still kicking on sub-500$ gaming PCs.","R13UWA4F9S6UPE",,,,"4 people found this helpful","Great Price/Performance",,"Reviewed in the United States on 18 August 2022","2144","192","Pattern Name: Processor","B08LKJPR5X"
"United States",,"2022-02-03",,"fiveStar","true","7",,,"B08LKJPR5X","5","https://www.amazon.in/product-reviews/B08LKJPR5X?pageNumber=10&filterByStar=five_star&sortBy=helpful&formatType=all_formats&language=en","Great performance But, You need a Video card to use this. You get 8 logical cores for 65 watts. Couple this with a Good GPU pci express card and You can do Moderate ganing.","R3RRQIOBUMT9VB",,,,"One person found this helpful","Great performance But, you need a Video card to use this",,"Reviewed in the United States on 3 February 2022","2144","192","Pattern Name: Processor","B08LKJPR5X"
"United States",,"2022-01-04",,"fiveStar","true","8",,,"B08LKJPR5X","5","https://www.amazon.in/product-reviews/B08LKJPR5X?pageNumber=10&filterByStar=five_star&sortBy=helpful&formatType=all_formats&language=en","Great cpu for budget gaming when paired with the right GPU. gets an average 100fps in gta V low setting with the rx550 4gb. Came in original packaging with stock cooler and all.","R1GPILPIHSSI3W",,,,"One person found this helpful","Great overall cpu for budget gaming.",,"Reviewed in the United States on 4 January 2022","2144","192","Pattern Name: Processor","B08LKJPR5X"
"United States",,"2021-12-15",,"fiveStar","true","9",,,"B08LKJPR5X","5","https://www.amazon.in/product-reviews/B08LKJPR5X?pageNumber=10&filterByStar=five_star&sortBy=helpful&formatType=all_formats&language=en","Best bang for your buck for a inexpensive system in 2021. Used/refurbished market is not a good deal right now. Building a budget build that you can upgrade later is the way to go.","R1C11G8SF2MSXX",,,,"2 people found this helpful","Best bang for your buck in 2021",,"Reviewed in the United States on 15 December 2021","2144","192","Pattern Name: Processor","B08LKJPR5X"
"United States",,"2021-09-30",,"fiveStar","true","10",,,"B08LKJPR5X","5","https://www.amazon.in/product-reviews/B08LKJPR5X?pageNumber=10&filterByStar=five_star&sortBy=helpful&formatType=all_formats&language=en","It’s Intel so it’s supposed to be meh. It does it’s job and was a necessary upgrade for an old pc I refurbished after a fried motherboard. (Old one had an ancient chipset, new one needed this generation processor)","R1SRME44F3Q4O7",,,,"One person found this helpful","It does what it should.",,"Reviewed in the United States on 30 September 2021","2144","192","Pattern Name: Processor","B08LKJPR5X"
"India",,"2023-09-19",,"fiveStar","false","1",,,"B08LKJPR5X","5","https://www.amazon.in/product-reviews/B08LKJPR5X?pageNumber=2&filterByStar=five_star&sortBy=helpful&formatType=all_formats&language=en","Intel is most trusted band ever,i must recomend you all,i was first hesitate becouse of noreturn policy but guys believe me there is no need to hasitate with this brand.","R1EYW7NRFFDRW6","https://m.media-amazon.com/images/I/51vz-p1ykcL._SY88.jpg",,,"","thanks amazon.","https://www.amazon.in/gp/customer-reviews/R1EYW7NRFFDRW6/ref=cm_cr_arp_d_rvw_ttl?ie=UTF8&ASIN=B08LKJPR5X","Reviewed in India on 19 September 2023","2144","192","Pattern Name: Processor","B08LKJPR5X"
"India",,"2023-05-19",,"fiveStar","false","2",,,"B08LKJPR5X","5","https://www.amazon.in/product-reviews/B08LKJPR5X?pageNumber=2&filterByStar=five_star&sortBy=helpful&formatType=all_formats&language=en","This processor is ok but It is necessary to install a graphic card with the processor.  Other wise the display will not come without a graphic card.","R3D19F46E4GROY",,,,"One person found this helpful","Display no without graphic card","https://www.amazon.in/gp/customer-reviews/R3D19F46E4GROY/ref=cm_cr_arp_d_rvw_ttl?ie=UTF8&ASIN=B08LKJPR5X","Reviewed in India on 19 May 2023","2144","192","Pattern Name: Processor","B08LKJPR5X"
"India",,"2021-01-03",,"fiveStar","false","3",,,"B08LKJPR5X","5","https://www.amazon.in/product-reviews/B08LKJPR5X?pageNumber=2&filterByStar=five_star&sortBy=helpful&formatType=all_formats&language=en","I bought it at 6559 only from offline market it's realy good not become a fool to buy from online.","R2I9WFUPQ11KTC",,,,"34 people found this helpful","Very Good price","https://www.amazon.in/gp/customer-reviews/R2I9WFUPQ11KTC/ref=cm_cr_arp_d_rvw_ttl?ie=UTF8&ASIN=B08LKJPR5X","Reviewed in India on 3 January 2021","2144","192","Pattern Name: Processor","B08LKJPR5X"
"India",,"2021-01-22",,"fiveStar","false","4",,,"B08LKJPR5X","5","https://www.amazon.in/product-reviews/B08LKJPR5X?pageNumber=2&filterByStar=five_star&sortBy=helpful&formatType=all_formats&language=en","In 8k price ( well you can get it in around 7k too ) it is the best cpu avilable right now..","R2CNBJ4MK27G4H",,,,"","Buy if price is around 8k","https://www.amazon.in/gp/customer-reviews/R2CNBJ4MK27G4H/ref=cm_cr_arp_d_rvw_ttl?ie=UTF8&ASIN=B08LKJPR5X","Reviewed in India on 22 January 2021","2144","192","Pattern Name: Processor","B08LKJPR5X"
"India",,"2021-07-27",,"fiveStar","false","5",,,"B08LKJPR5X","5","https://www.amazon.in/product-reviews/B08LKJPR5X?pageNumber=2&filterByStar=five_star&sortBy=helpful&formatType=all_formats&language=en","","R2DLZ9VT0M9T7E","https://m.media-amazon.com/images/I/8158Z-UvOSL._SY88.jpg","https://m.media-amazon.com/images/I/81KTePkN5vL._SY88.jpg","https://m.media-amazon.com/images/I/81hpETfGMjL._SY88.jpg","","Good package..... The BEST.... 😍😍","https://www.amazon.in/gp/customer-reviews/R2DLZ9VT0M9T7E/ref=cm_cr_arp_d_rvw_ttl?ie=UTF8&ASIN=B08LKJPR5X","Reviewed in India on 27 July 2021","2144","192","Pattern Name: Processor","B08LKJPR5X"
"India",,"2021-07-08",,"fiveStar","true","6",,,"B08LKJPR5X","5","https://www.amazon.in/product-reviews/B08LKJPR5X?pageNumber=2&filterByStar=five_star&sortBy=helpful&formatType=all_formats&language=en","Don’t buy from Amazon as it’s costly here. It’s better to buy from retail market. i3 10100F has good performances on modern gaming but it requires a dedicated graphic card.","R1SNOTC8CBIJ8I","https://images-na.ssl-images-amazon.com/images/I/B1QFK4P-U0S._SY88.jpg",,,"One person found this helpful","Value for money.","https://www.amazon.in/gp/customer-reviews/R1SNOTC8CBIJ8I/ref=cm_cr_arp_d_rvw_ttl?ie=UTF8&ASIN=B08LKJPR5X","Reviewed in India on 8 July 2021","2144","192","Pattern Name: Processor","B08LKJPR5X"
"India",,"2022-07-30",,"fiveStar","true","7",,,"B08LKJPR5X","5","https://www.amazon.in/product-reviews/B08LKJPR5X?pageNumber=2&filterByStar=five_star&sortBy=helpful&formatType=all_formats&language=en","1. for use this chip graphics card / displace card required for mother board","R2BRP0HQSFSLD",,,,"","About product","https://www.amazon.in/gp/customer-reviews/R2BRP0HQSFSLD/ref=cm_cr_arp_d_rvw_ttl?ie=UTF8&ASIN=B08LKJPR5X","Reviewed in India on 30 July 2022","2144","192","Pattern Name: Processor","B08LKJPR5X"
"India",,"2021-10-20",,"fiveStar","true","8",,,"B08LKJPR5X","5","https://www.amazon.in/product-reviews/B08LKJPR5X?pageNumber=2&filterByStar=five_star&sortBy=helpful&formatType=all_formats&language=en","Best budget gaming processor. Most of us (gamers) are budget gamers and this processor served it's purpose very well. I love it.","R367K856V9OMDT",,,,"","Best budget gaming processor in 2021","https://www.amazon.in/gp/customer-reviews/R367K856V9OMDT/ref=cm_cr_arp_d_rvw_ttl?ie=UTF8&ASIN=B08LKJPR5X","Reviewed in India on 20 October 2021","2144","192","Pattern Name: Processor","B08LKJPR5X"
"India",,"2021-09-26",,"fiveStar","true","9",,,"B08LKJPR5X","5","https://www.amazon.in/product-reviews/B08LKJPR5X?pageNumber=2&filterByStar=five_star&sortBy=helpful&formatType=all_formats&language=en","Fast boothing","R2DI4CKPJ0TSYL",,,,"","10 generation","https://www.amazon.in/gp/customer-reviews/R2DI4CKPJ0TSYL/ref=cm_cr_arp_d_rvw_ttl?ie=UTF8&ASIN=B08LKJPR5X","Reviewed in India on 26 September 2021","2144","192","Pattern Name: Processor","B08LKJPR5X"
"India",,"2021-11-13",,"fiveStar","true","10",,,"B08LKJPR5X","5","https://www.amazon.in/product-reviews/B08LKJPR5X?pageNumber=2&filterByStar=five_star&sortBy=helpful&formatType=all_formats&language=en","Nyc 👍","RHUNAHOBL4YDA","https://m.media-amazon.com/images/I/71wQxuCJQeL._SY88.jpg",,,"","Good","https://www.amazon.in/gp/customer-reviews/RHUNAHOBL4YDA/ref=cm_cr_arp_d_rvw_ttl?ie=UTF8&ASIN=B08LKJPR5X","Reviewed in India on 13 November 2021","2144","192","Pattern Name: Processor","B08LKJPR5X"
"Japan",,"2021-09-20",,"fourStar","true","1",,,"B08LKJPR5X","4","https://www.amazon.in/product-reviews/B08LKJPR5X?pageNumber=4&filterByStar=four_star&sortBy=helpful&formatType=all_formats&language=en","１万円のCPUとしては、ゲームをやるわけではなく、コストパフォーマンスは最高ですね。","R3DXDJ1557HHNP",,,,"One person found this helpful","コストパフォーマンスがいいですね。",,"Reviewed in Japan on 20 September 2021","352","36","Pattern Name: Processor","B08LKJPR5X"
"Japan",,"2021-07-18",,"fourStar","true","2",,,"B08LKJPR5X","4","https://www.amazon.in/product-reviews/B08LKJPR5X?pageNumber=4&filterByStar=four_star&sortBy=helpful&formatType=all_formats&language=en","コスパが良い。","R2O317QA6ZML8C",,,,"One person found this helpful","コスパ良し。",,"Reviewed in Japan on 18 July 2021","352","36","Pattern Name: Processor","B08LKJPR5X"
"Japan",,"2021-02-09",,"fourStar","true","3",,,"B08LKJPR5X","4","https://www.amazon.in/product-reviews/B08LKJPR5X?pageNumber=4&filterByStar=four_star&sortBy=helpful&formatType=all_formats&language=en","性能は第6世代core i7 6700k相当あります。それが1万円ちょっとの値段で買える時代がやってきました。やったね。","RBJIHIWWR2LKM",,,,"3 people found this helpful","SkyLake時代からの乗り換えに良いです",,"Reviewed in Japan on 9 February 2021","352","36","Pattern Name: Processor","B08LKJPR5X"
"Japan",,"2021-03-01",,"fourStar","true","4",,,"B08LKJPR5X","4","https://www.amazon.in/product-reviews/B08LKJPR5X?pageNumber=4&filterByStar=four_star&sortBy=helpful&formatType=all_formats&language=en","まず、コストパフォーマンスですが１万円（購入時）で3世代前のcore-i7に匹敵する処理速度を持っている上に、消費電力も抑えられているので、自分のように低価格でゲーミングpcを組みたい方などにお勧めです。ですが、廉価グレードということもあり重たいゲームや4k映画視聴の際などには少なからず上位モデルとの差を感じます。１万円でここまでのcpuを手に入れられるのでいい買い物だったと思います。おススメです。","RZS2ANWURMHAZ",,,,"5 people found this helpful","コスパだけで言えば最高です。",,"Reviewed in Japan on 1 March 2021","352","36","Pattern Name: Processor","B08LKJPR5X"
"Japan",,"2021-03-15",,"fourStar","true","5",,,"B08LKJPR5X","4","https://www.amazon.in/product-reviews/B08LKJPR5X?pageNumber=4&filterByStar=four_star&sortBy=helpful&formatType=all_formats&language=en","やはり最新。安定の性能。","R3PQGHLE1OCX0O",,,,"One person found this helpful","凄い進化。",,"Reviewed in Japan on 15 March 2021","352","36","Pattern Name: Processor","B08LKJPR5X"
"Japan",,"2020-11-22",,"fourStar","true","6",,,"B08LKJPR5X","4","https://www.amazon.in/product-reviews/B08LKJPR5X?pageNumber=4&filterByStar=four_star&sortBy=helpful&formatType=all_formats&language=en","アセコルも3Dモデもカクツクようになった。絶対買わない方がいい。1ヶ月使用していたら突然性能が上がり、カクツキ散らかしてたのにそれもなくなり以前は8〜50fpsしか出なかったのが、今は150〜250fpsになりました。多分OSアップデートが原因かと思います。発売翌日くらいに購入したのでOSに個人差（構成による）があったのかなとか考えているところです。","R36FFHNXKYB7O5",,,,"26 people found this helpful","性能が上がった。OSが問題？？",,"Reviewed in Japan on 22 November 2020","352","36","Pattern Name: Processor","B08LKJPR5X"
"United States",,"2023-04-14",,"fiveStar","true","1",,,"B08LKJPR5X","5","https://www.amazon.in/product-reviews/B08LKJPR5X?pageNumber=9&filterByStar=five_star&sortBy=helpful&formatType=all_formats&language=en","Buen desempeño en ofimática y para jugar algunos títulos","RTF36WFXY3IMP",,,,"2 people found this helpful","Calidad precio",,"Reviewed in the United States on 14 April 2023","2144","192","Pattern Name: Processor","B08LKJPR5X"
"Canada",,"2022-08-23",,"fiveStar","true","2",,,"B08LKJPR5X","5","https://www.amazon.in/product-reviews/B08LKJPR5X?pageNumber=9&filterByStar=five_star&sortBy=helpful&formatType=all_formats&language=en","Good for budget gaming, but I should have saved for the i5 10th gen","R2D44BL4FYCDDC",,,,"","t o e s",,"Reviewed in Canada on 23 August 2022","2144","192","Pattern Name: Processor","B08LKJPR5X"
"United States",,"2022-10-09",,"fiveStar","true","3",,,"B08LKJPR5X","5","https://www.amazon.in/product-reviews/B08LKJPR5X?pageNumber=9&filterByStar=five_star&sortBy=helpful&formatType=all_formats&language=en","For a 4 core and 8 thread processor its quite a catch in running my work related applications and gaming","R3T4GVKS14WOHI",,,,"","Fabulous chip for the price.",,"Reviewed in the United States on 9 October 2022","2144","192","Pattern Name: Processor","B08LKJPR5X"
"United States",,"2022-10-09",,"fiveStar","true","4",,,"B08LKJPR5X","5","https://www.amazon.in/product-reviews/B08LKJPR5X?pageNumber=9&filterByStar=five_star&sortBy=helpful&formatType=all_formats&language=en","I used this processor a couple times. It's not bad for mid-range gaming. This is great for someone starting out thats just getting into gaming.","RW5N3MC34T38C",,,,"One person found this helpful","Totally surprised by performance.",,"Reviewed in the United States on 9 October 2022","2144","192","Pattern Name: Processor","B08LKJPR5X"
"United States",,"2022-08-15",,"fiveStar","true","5",,,"B08LKJPR5X","5","https://www.amazon.in/product-reviews/B08LKJPR5X?pageNumber=9&filterByStar=five_star&sortBy=helpful&formatType=all_formats&language=en","It was one of the cheapest cpu's with this kind of speed and efficiency.  Everything runs fast and wasn't expecting this much performance for this kind of price","R2UYQSRZI2ETJE",,,,"5 people found this helpful","The best for the value",,"Reviewed in the United States on 15 August 2022","2144","192","Pattern Name: Processor","B08LKJPR5X"
"United States",,"2022-11-21",,"fiveStar","true","6",,,"B08LKJPR5X","5","https://www.amazon.in/product-reviews/B08LKJPR5X?pageNumber=9&filterByStar=five_star&sortBy=helpful&formatType=all_formats&language=en","Enough processing power for RX 580. The stock cooler is noisy during gameplay but worked ok until I replaced it.","R11OCG45HVDI9H",,,,"","Still Good Enough for some Gaming",,"Reviewed in the United States on 21 November 2022","2144","192","Pattern Name: Processor","B08LKJPR5X"
"United States",,"2022-03-23",,"fiveStar","true","7",,,"B08LKJPR5X","5","https://www.amazon.in/product-reviews/B08LKJPR5X?pageNumber=9&filterByStar=five_star&sortBy=helpful&formatType=all_formats&language=en","This hold up great for gaming if you already have a GPU. You might struggle if you’re trying to stream as well but haven’t had any issues so far and has been a huge upgrade. Pairing with a 1070.","RO8S84P5CZ3W8",,,,"2 people found this helpful","Great CPU",,"Reviewed in the United States on 23 March 2022","2144","192","Pattern Name: Processor","B08LKJPR5X"
"United States",,"2022-07-25",,"fiveStar","true","8",,,"B08LKJPR5X","5","https://www.amazon.in/product-reviews/B08LKJPR5X?pageNumber=9&filterByStar=five_star&sortBy=helpful&formatType=all_formats&language=en","Installed this CPU a few days ago, and it's been working great so far! It was very easy to install and has been working flawlessly! 5 stars from me.","R3518MBE6EKLFD",,,,"4 people found this helpful","Amazing, and worth the price!",,"Reviewed in the United States on 25 July 2022","2144","192","Pattern Name: Processor","B08LKJPR5X"
"Canada",,"2022-09-22",,"fiveStar","true","9",,,"B08LKJPR5X","5","https://www.amazon.in/product-reviews/B08LKJPR5X?pageNumber=9&filterByStar=five_star&sortBy=helpful&formatType=all_formats&language=en","Great CPU for everyday use.","R1NPIYOS22EKJW",,,,"One person found this helpful","Great budget CPU.",,"Reviewed in Canada on 22 September 2022","2144","192","Pattern Name: Processor","B08LKJPR5X"
"United States",,"2023-01-19",,"fiveStar","true","10",,,"B08LKJPR5X","5","https://www.amazon.in/product-reviews/B08LKJPR5X?pageNumber=9&filterByStar=five_star&sortBy=helpful&formatType=all_formats&language=en","new. ideal. of the highest quality. Thanks to Jeff Bezos and Amazon. From Georgia.","R2KSJJUU7NJT4F",,,,"","new. ideal. of the highest quality. Thanks to Jeff Bezos and Amazon. From Georgia.",,"Reviewed in the United States on 19 January 2023","2144","192","Pattern Name: Processor","B08LKJPR5X"
"India",,"2021-10-11",,"fiveStar","true","1",,,"B08LKJPR5X","5","https://www.amazon.in/product-reviews/B08LKJPR5X?pageNumber=3&filterByStar=five_star&sortBy=helpful&formatType=all_formats&language=en","","R3JWWSGVSN30D1","https://m.media-amazon.com/images/I/612AdqGQP6L._SY88.jpg","https://m.media-amazon.com/images/I/61b8C6O9v+L._SY88.jpg","https://m.media-amazon.com/images/I/71jPnuK-EsL._SY88.jpg","","Rem","https://www.amazon.in/gp/customer-reviews/R3JWWSGVSN30D1/ref=cm_cr_arp_d_rvw_ttl?ie=UTF8&ASIN=B08LKJPR5X","Reviewed in India on 11 October 2021","2144","192","Pattern Name: Processor","B08LKJPR5X"
